Title,Rating,Calories,Protein,Fat,Sodium,Price
Garlic-Roasted Shrimp with Red Peppers and Smoked Paprika ,4.375,133.0,12.0,8.0,510.0,59.0,
Chinese Egg Noodles with Smoked Duck and Snow Peas ,3.125,511.0,38.0,36.0,758.0,75.0,
Shrimp Fried Rice with Ginger ,4.375,587.0,36.0,48.0,333.0,12.0,
Cranberry Caramel Sauce ,4.375,402.0,0.0,0.0,3.0,32.0,
Potato and Shiitake Mushroom Gratin ,4.375,343.0,13.0,21.0,472.0,81.0,
Nems ,3.75,234.0,6.0,11.0,1230.0,59.0,
Baked Camembert with Hazelnut Crust ,3.75,129.0,7.0,9.0,272.0,38.0,
Sauteed Pineapple with Rum Sauce ,4.375,496.0,4.0,26.0,7.0,73.0,
Spiced Marinated Lamb Chops with Garlicky Yogurt ,3.75,794.0,67.0,49.0,861.0,41.0,
Buby ,0.0,179.0,0.0,0.0,4.0,14.0,
Japanese Beef and Scallion Rolls ,4.375,187.0,17.0,9.0,482.0,75.0,
Yarnall Family's Fyrstekake (Norwegian Cardamom-Almond Tart) ,0.0,523.0,8.0,19.0,694.0,62.0,
Gluten-Free Blueberry Corn Muffins ,3.75,248.0,4.0,10.0,391.0,99.0,
Chicken and Bell Pepper Pizza with Barbecue Sauce ,3.75,710.0,44.0,33.0,1287.0,27.0,
Orange-Almond Lace Cookies ,4.375,131.0,2.0,10.0,52.0,80.0,
Rum-Raisin Pound Cake ,3.75,489.0,6.0,22.0,163.0,43.0,
Shrimp and Vegetables in Ginger Coriander Broth ,3.75,389.0,31.0,12.0,1285.0,49.0,
Florentine White Bean Soup with Pasta ,5.0,676.0,21.0,33.0,487.0,93.0,
Turkey Potpie with Cheddar Biscuit Crust ,4.375,1851.0,242.0,73.0,1533.0,72.0,
Curried Chicken-Coconut Soup ,3.75,633.0,19.0,22.0,264.0,75.0,
Spicy Savoy Slaw ,3.75,92.0,4.0,2.0,341.0,40.0,
Green Bean and Tomato Salad with Buttermilk Dressing ,0.0,139.0,4.0,7.0,59.0,19.0,
Garlic Roast Pork ,5.0,1311.0,104.0,94.0,2136.0,96.0,
Curried Chicken Soup with Carrots ,4.375,448.0,26.0,28.0,229.0,34.0,
Honey Custard in Phyllo Pastry ,4.375,378.0,6.0,28.0,208.0,22.0,
Raspberry and Brown Sugar Custard Tart ,4.375,504.0,5.0,37.0,183.0,79.0,
Beef and Mushroom Stew ,3.125,694.0,48.0,30.0,3036.0,39.0,
Endive and Asian Pear Salad ,3.75,87.0,1.0,8.0,15061.0,44.0,
Frozen Raspberry Mousse ,3.75,299.0,2.0,15.0,22.0,16.0,
Braised Spiced Pork with Cao Lau Noodles ,3.75,1134.0,79.0,63.0,502.0,68.0,
Stuffed Cornish Hens with Port Sauce ,3.125,892.0,54.0,55.0,283.0,79.0,
Black-Eyed Pea Curry ,3.75,196.0,7.0,8.0,319.0,64.0,
Fruit Salad with Poppy Seed Dressing ,3.75,373.0,3.0,20.0,147.0,33.0,
Spicy Stir-Fried Brown Rice with Broccolini and Scallops ,4.375,394.0,18.0,8.0,787.0,68.0,
Steaks with Blue Cheese and Toasted Walnut Butter ,3.75,1241.0,55.0,41.0,1343.0,68.0,
Prosciutto-Artichoke Sandwiches with Rosemary Mayonnaise ,4.375,479.0,17.0,42.0,713.0,32.0,
Chicken with Figs in Ras-el-Hanout and Couscous ,2.5,4494.0,73.0,253.0,3548.0,91.0,
Baked Ziti with Spicy Pork and Sausage Ragù ,4.375,1056.0,78.0,79.0,753.0,18.0,
Halibut with Red Bell Pepper and Olive Relish ,4.375,397.0,50.0,16.0,442.0,83.0,
Tapenade Caesar with Prosciutto ,5.0,655.0,21.0,47.0,1171.0,27.0,
Sweet-Potato and Parsnip Purée ,4.375,295.0,4.0,10.0,367.0,65.0,
Baked Fish with Ratatouille ,4.375,339.0,36.0,15.0,257.0,94.0,
Pork Tenderloin with Balsamic-Cranberry Sauce ,4.375,331.0,28.0,14.0,103.0,81.0,
Cardamom Pound Cake ,3.125,442.0,7.0,24.0,276.0,16.0,
Banana Cream Pie with Salty Bourbon Caramel ,3.75,641.0,45.0,47.0,202.0,68.0,
Chamomile Crème Anglaise ,3.75,185.0,5.0,13.0,39.0,49.0,
Green Onion-Dill Matzo Balls ,4.375,79.0,2.0,6.0,168.0,72.0,
Banana Oatmeal Chocolate Chip Cookies ,1.25,107.0,2.0,3.0,22.0,11.0,
Koffie Van Brunt ,3.75,234.0,1.0,6.0,11.0,27.0,
Pork Tenderloin Churrasco ,4.375,776.0,5.0,82.0,168.0,97.0,
Rum-Raisin Chocolate Brownies ,4.375,346.0,4.0,17.0,23.0,21.0,
Lamb and Orzo Stuffed Pepper with Chunky Tomato Sauce ,3.75,787.0,9.0,37.0,580.0,60.0,
Crème de Cacao Egg Cream ,3.75,255.0,2.0,2.0,44.0,48.0,
Crazy Cantina Chili ,4.375,742.0,18.0,50.0,1201.0,88.0,
Beet Carpaccio with Goat Cheese and Mint Vinaigrette ,4.375,160.0,5.0,14.0,121.0,100.0,
Gordon's Pot Roast ,3.75,1178.0,73.0,78.0,1704.0,45.0,
Crisp Curry Chicken Wings with Coriander Cucumber Sauce ,3.75,109.0,9.0,7.0,149.0,75.0,
Lazy Texas Brisket ,4.375,525.0,7.0,24.0,129.0,66.0,
Red Velvet Cake with Raspberries and Blueberries ,5.0,606.0,6.0,24.0,165.0,51.0,
Bittersweet Chocolate and Almond Cake ,3.125,786.0,32.0,29.0,921.0,61.0,
Bacon and Egg Empañadas ,4.375,929.0,33.0,73.0,229.0,11.0,
Broccoli Rabe with Sweet Italian Sausage ,4.375,242.0,19.0,16.0,541.0,93.0,
Cassata Cake ,4.375,330.0,4.0,18.0,87.0,58.0,
Matzo-Stuffed Roast Chicken for Passover ,0.0,173.0,16.0,7.0,202.0,51.0,
Coconut Lime Mussels ,4.375,320.0,22.0,16.0,497.0,73.0,
Dried-Fruit Compote with White Wine ,3.75,137.0,1.0,0.0,16.0,86.0,
Walnut-Date Torte ,3.75,322.0,7.0,14.0,109.0,48.0,
Flour Tortillas ,4.375,193.0,4.0,5.0,238.0,72.0,
Poached Chicked with Curried Yogurt Sauce ,3.125,106.0,11.0,4.0,95.0,18.0,
Potage Saint-Germain Gerhard ,0.0,219.0,7.0,14.0,637.0,21.0,
Nutmeg Ice Cream ,4.375,207.0,4.0,12.0,91.0,57.0,
Raisin Pie ,4.375,278.0,4.0,3.0,155.0,56.0,
Ropa Vieja ,4.375,630.0,19.0,37.0,364.0,29.0,
Fluffy Cathead Biscuits With Honey Butter ,5.0,334.0,5.0,16.0,612.0,73.0,
Individual Orange and Poppy Seed Pound Cakes ,5.0,1221.0,49.0,86.0,613.0,94.0,
Eggnoggin ,0.0,203.0,1.0,8.0,18.0,63.0,
Pecan Currant Bread ,3.75,4314.0,223.0,369.0,771.0,66.0,
Bengali-Style Fish in Yogurt Curry ,3.125,313.0,19.0,24.0,468.0,25.0,
Grilled Turkey with Toasted Fennel and Coriander and Fresh Thyme Gravy ,4.375,965.0,63.0,76.0,1126.0,92.0,
Roasted Pacific Cod with Spring Vegetables and Mint ,4.375,345.0,37.0,15.0,306.0,82.0,
Berbere-Crusted Rack of Lamb ,4.375,1596.0,115.0,60.0,3773.0,57.0,
Caramelized-Shallot Mashed Potatoes ,4.375,275.0,5.0,13.0,30.0,28.0,
Winter Vegetable and Beef Soup ,4.375,719.0,42.0,61.0,891.0,64.0,
Ricotta Puddings with Glazed Rhubarb ,3.75,194.0,6.0,10.0,105.0,75.0,
Carrot Ginger Dressing ,4.375,314.0,1.0,31.0,335.0,94.0,
Apricot Galette ,3.75,515.0,7.0,33.0,203.0,17.0,
Grilled Pineapple Salsa ,3.75,47.0,1.0,0.0,467.0,94.0,
Sausage and Potato Breakfast Casserole ,4.375,421.0,21.0,29.0,743.0,79.0,
Orange Crème Fraîche ,0.0,113.0,1.0,10.0,19.0,31.0,
Yogurt Cake with Currant Raspberry Sauce ,4.375,879.0,49.0,60.0,1693.0,56.0,
Horseradish-Yogurt Sauce ,0.0,110.0,9.0,6.0,507.0,82.0,
Grilled Country Ribs with Summer Savory Mustard Marinade ,5.0,1881.0,327.0,43.0,13875.0,46.0,
Lemon-Honey Tart with Salted Shortbread Crust ,4.375,485.0,7.0,21.0,391.0,56.0,
Open Shrimp Ravioli with Lime Ginger Butter ,4.375,588.0,6.0,25.0,19.0,95.0,
Orange-Soy-Braised Pork Ribs ,5.0,1717.0,245.0,68.0,3591.0,86.0,
Toasted Marshmallow Butterscotch Pie ,4.375,663.0,47.0,44.0,996.0,71.0,
Sage-Seared Pork Cutlets with Apples ,4.375,466.0,32.0,30.0,83.0,15.0,
Espresso-Hazelnut Cheesecake ,4.375,684.0,18.0,49.0,544.0,31.0,
Potato Rosemary Focaccia ,4.375,304.0,7.0,7.0,595.0,83.0,
Braised Beef Short Ribs ,3.75,1391.0,52.0,128.0,682.0,86.0,
Wild Rice Stuffing with Wild Mushrooms ,4.375,495.0,13.0,14.0,67.0,62.0,
Pasta with Creamy Vodka-and-Herb Sauce ,4.375,968.0,9.0,50.0,273.0,48.0,
Basil Flatbread with Roasted Tomatoes and Basil Oil ,4.375,575.0,13.0,23.0,1924.0,22.0,
Grapefruit Tart ,4.375,225.0,3.0,13.0,145.0,74.0,
Thai Curry Penne with Ginger-Tomato Chutney ,4.375,537.0,31.0,28.0,249.0,94.0,
Maple Pumpkin Pots de Crème ,4.375,157.0,3.0,8.0,51.0,78.0,
Zucchini-Pecan Cake with Cream Cheese Frosting ,4.375,453.0,6.0,31.0,315.0,16.0,
Rack of Lamb with Caramelized Shallot and Thyme Crust ,4.375,2103.0,76.0,172.0,1699.0,81.0,
Salade Chaude aux Lentilles Avec Vinaigrette à la Moutarde ,4.375,281.0,11.0,16.0,173.0,21.0,
Three-Cheese Chicken Breasts in Tomato Sauce ,3.75,401.0,18.0,20.0,752.0,89.0,
Chocolate-Peanut Butter Cake with Cream Cheese and Butterfinger Frosting ,4.375,973.0,63.0,63.0,411.0,36.0,
Harry's Strawberry and Tomato Salad ,3.75,85.0,2.0,4.0,299.0,17.0,
Potato Croquetas with Saffron Alioli ,5.0,252.0,5.0,17.0,201.0,43.0,
Black Gold Cookies ,4.375,542.0,11.0,36.0,293.0,21.0,
Macadamia Nut and Bittersweet Chocolate Ice-Cream Bombe with Macadamia Nut Praline ,4.375,1230.0,80.0,79.0,1230.0,30.0,
Apple and Tart Cherry Pie ,5.0,298.0,2.0,5.0,43.0,82.0,
Peach Crumb Cake ,3.75,291.0,4.0,15.0,135.0,16.0,
Blue Cheese Toasts ,3.75,881.0,27.0,52.0,816.0,35.0,
Mediterranean Roasted Vegetable Salad ,4.375,171.0,6.0,10.0,170.0,13.0,
Pickled Vegetable Lettuce Cups ,5.0,36.0,2.0,1.0,759.0,100.0,
Thick Focaccia ,3.75,287.0,9.0,7.0,550.0,19.0,
Grilled Lamb and Fig Skewers with Mint-Pepper Glaze and Grilled Eggplant ,0.0,790.0,53.0,60.0,307.0,79.0,
Mai Tai II ,5.0,243.0,0.0,0.0,3.0,87.0,
Coriander and Mustard Seed Chicken ,4.375,2008.0,111.0,156.0,2244.0,67.0,
Lemon Fettuccine with Asparagus and Salmon Caviar ,4.375,878.0,48.0,61.0,251.0,53.0,
Yellow Squash and Bell Pepper Torte ,3.125,277.0,7.0,15.0,141.0,40.0,
Lorrie's Mother's Fruitcake ,4.375,784.0,25.0,35.0,1870.0,19.0,
Cheeseburgers with Charred Green Chiles and Onions ,4.375,567.0,7.0,36.0,219.0,99.0,
Bigeye Tuna with Red Currant and Apple Vinaigrette and Snap Peas ,0.0,223.0,8.0,15.0,627.0,39.0,
Meringue-Topped Baked Grapefruit ,3.75,166.0,5.0,0.0,56.0,87.0,
Linguine with Collard Greens and Bacon ,4.375,1347.0,16.0,79.0,408.0,66.0,
Toasted-Hazelnut Cake ,4.375,407.0,10.0,28.0,108.0,95.0,
Lemon-Garlic Baked Shrimp ,3.75,372.0,24.0,29.0,968.0,96.0,
Cantaloupe Conserve ,3.125,130.0,1.0,0.0,20.0,72.0,
Basic Green Chile ,4.375,111.0,6.0,2.0,1206.0,94.0,
Chunky Almond Oil ,0.0,128.0,2.0,13.0,2.0,19.0,
Italian Sausages with Broccoli Rabe and Polenta ,4.375,1807.0,16.0,117.0,920.0,46.0,
Guacamole with Aleppo Pepper ,3.75,180.0,2.0,16.0,247.0,98.0,
Roast Pork Tenderloin with Pears and Dried Apricots ,4.375,512.0,35.0,25.0,308.0,59.0,
Grilled Chicken with Thai-Spiced Oil ,3.75,668.0,29.0,31.0,1102.0,55.0,
Pomegranate Mimosas ,4.375,182.0,0.0,0.0,12.0,88.0,
Red Wine and Mushroom Risotto ,4.375,753.0,8.0,39.0,291.0,39.0,
Peppercorn- and Thyme-Roasted Goose ,4.375,1979.0,48.0,130.0,2609.0,93.0,
Exotic Caramel Sauce ,5.0,388.0,3.0,17.0,15.0,20.0,
Special Sunday Roast Chicken ,3.75,1414.0,50.0,129.0,196.0,99.0,
Ultimate Turkey Stock ,5.0,314.0,32.0,18.0,137.0,29.0,
Maple Corn Bread ,3.125,366.0,8.0,12.0,533.0,25.0,
Spanish Crusted Roast Pork Tenderloin ,4.375,237.0,21.0,13.0,108.0,71.0,
Honey Nut Squares ,3.75,158.0,3.0,11.0,47.0,38.0,
Citrus Tart ,3.75,554.0,55.0,28.0,1394.0,79.0,
Apple and Blackberry Pie ,3.75,597.0,50.0,37.0,234.0,81.0,
Russian Walnut-Cherry Latkes with Cherry-Apple Sauce ,0.0,96.0,4.0,7.0,108.0,66.0,
Yogurt Marinated Grilled Chicken ,4.375,1234.0,87.0,76.0,347.0,81.0,
Trio of Marinated Goat Cheeses ,5.0,335.0,5.0,34.0,272.0,53.0,
Sauteed Scallops with Ginger ,3.75,255.0,21.0,14.0,672.0,64.0,
Spinach Fennel Soup ,3.125,300.0,15.0,15.0,94.0,14.0,
Butternut Squash and Corn Chowder ,3.75,266.0,5.0,8.0,1189.0,52.0,
White Cheddar Polenta with Sauteed Greens and Garlic-Roasted Portobellos ,3.75,476.0,16.0,29.0,1431.0,14.0,
Peach and Mango Daiquiri ,3.75,216.0,2.0,0.0,1.0,85.0,
Spinach Lasagne Rolls ,3.125,661.0,35.0,54.0,274.0,45.0,
Pikliz (Haitian Pickled Vegetable Relish) ,3.75,166.0,8.0,6.0,703.0,96.0,
Charred Eggplant and Tahini Spread ,4.375,183.0,2.0,16.0,8.0,44.0,
Hazelnut-Crusted Trout ,3.75,663.0,35.0,27.0,363.0,72.0,
Brown and Wild Rice with Sausage and Fennel ,5.0,1167.0,50.0,71.0,1789.0,41.0,
Caramelized Bananas ,5.0,185.0,1.0,6.0,3.0,59.0,
Quince and Currant Chutney ,5.0,203.0,2.0,0.0,63.0,50.0,
Coconut Mango Sorbet ,4.375,207.0,1.0,3.0,11.0,35.0,
Orange Yogurt Panna Cottas with Cranberry Orange Sauce ,3.75,174.0,8.0,0.0,91.0,34.0,
Spiced Fava Bean Soup with Rice and Tomato ,3.75,332.0,8.0,23.0,196.0,83.0,
Chicken and Cashew Stir-Fry ,4.375,477.0,24.0,37.0,825.0,33.0,
Baked Falafel With Orange-Tahini Sauce ,3.125,869.0,63.0,53.0,177.0,46.0,
Roasted Sweet Onions with Cabrales Blue Cheese ,5.0,275.0,6.0,21.0,180.0,59.0,
Orange-Flower Pavlovas with Strawberries ,4.375,181.0,2.0,6.0,26.0,45.0,
Fried Chicken with Bacon and Pepper Cream Gravy ,4.375,2639.0,198.0,185.0,3657.0,23.0,
Tiny Corn Muffins ,1.875,100.0,2.0,3.0,182.0,22.0,
Curried Rice Pilaf with Cashews ,4.375,333.0,6.0,14.0,409.0,65.0,
Pecan Torte with Strawberries and Cream ,4.375,277.0,6.0,16.0,108.0,35.0,
Pasta with Eggplant and Basil Sauce ,4.375,694.0,59.0,32.0,824.0,24.0,
Mustard Watercress Sauce ,3.75,189.0,2.0,18.0,241.0,61.0,
Shark Kebabs with Orange-Avocado Salsa ,4.375,436.0,38.0,25.0,228.0,92.0,
Coconut Blondies ,4.375,167.0,2.0,9.0,77.0,83.0,
Creamy Caramel Sauce ,4.375,625.0,2.0,12.0,42.0,46.0,
Folly Island Shrimp and Grits ,4.375,717.0,81.0,41.0,2303.0,40.0,
Beer-Battered Fish with Smoked-Paprika Mayonnaise ,3.75,767.0,34.0,57.0,1249.0,89.0,
Shrimp Dumplings ,3.75,253.0,11.0,6.0,515.0,90.0,
Plum-Fennel Salad with Honey-Ginger Dressing ,0.0,58.0,1.0,0.0,84.0,53.0,
Mint Chocolate Soufflé Crepes ,3.125,340.0,9.0,14.0,258.0,80.0,
Cumin-Chile Lamb Kebabs With Garlic Yogurt ,5.0,495.0,30.0,38.0,146.0,70.0,
White Chocolate and Orange Soufflé ,3.75,338.0,6.0,18.0,70.0,80.0,
Dill-Cured Pork Crostini with Sweet Mustard Sauce ,4.375,54.0,5.0,1.0,526.0,85.0,
Chocolate Swirl Tiramisu ,3.125,731.0,32.0,65.0,109.0,80.0,
Spice Cake with Blackberry Filling and Cream Cheese Frosting ,4.375,895.0,56.0,68.0,1310.0,13.0,
Julia's and Jacques's Deglazing Sauce for Roast Chicken ,4.375,67.0,2.0,1.0,651.0,74.0,
Molasses-and-Buttermilk Gingerbread Squares ,4.375,153.0,2.0,6.0,63.0,22.0,
Salmon Glazed with Honey and Mustard ,5.0,596.0,1.0,59.0,447.0,16.0,
Miso-Marinated Salmon with Citrus and Shiitakes ,4.375,502.0,39.0,34.0,106.0,54.0,
Pork Chops with Mustard Crust ,3.75,659.0,41.0,53.0,461.0,13.0,
Pine Nut Crescents ,4.375,150.0,3.0,10.0,24.0,69.0,
Yogurt Poppy Seed Dressing ,1.875,74.0,4.0,4.0,576.0,53.0,
Fideos with Mussels ,2.5,414.0,31.0,20.0,1716.0,100.0,
Arrabbiata Sauce ,2.5,54.0,2.0,3.0,9.0,97.0,
Goat Cheese Salad ,4.375,204.0,6.0,13.0,213.0,56.0,
Sauteed Pork Tenderloin and Pears in Mustard-Port Sauce ,4.375,400.0,26.0,13.0,139.0,54.0,
Grilled Zucchini with Garlic and Lemon Butter Baste ,4.375,129.0,2.0,12.0,13.0,90.0,
Homemade Grenadine ,0.0,228.0,0.0,0.0,6.0,70.0,
A Hollywood Ham ,3.75,647.0,11.0,41.0,436.0,35.0,
Pork Rib Chops with Sauteed Apple and Star Anise ,5.0,1503.0,117.0,94.0,906.0,69.0,
Pan-Cooked Bass with Dill and Cucumber ,5.0,248.0,32.0,12.0,409.0,69.0,
Barbecued Pork Fried Rice ,3.75,300.0,29.0,10.0,1347.0,22.0,
Chocolate Almond Torte (Torta Caprese) ,4.375,278.0,5.0,21.0,21.0,53.0,
Coffee-Spice Shortbread with Crystallized Ginger ,3.125,109.0,0.0,8.0,55.0,67.0,
Spaghetti with Lobster and Mussels ,4.375,279.0,29.0,2.0,594.0,89.0,
Lemony Rice Soup with Ham and Spring Vegetables ,3.75,457.0,31.0,22.0,1159.0,74.0,
Steamed Savoy Cabbage and Mustard Greens with Bacon ,3.75,299.0,8.0,26.0,317.0,75.0,
Grilled Salmon Fillets with Creamy Horseradish Sauce ,5.0,573.0,36.0,45.0,540.0,88.0,
Seared Tuna with Green Onion-Wasabi Sauce ,4.375,326.0,45.0,13.0,848.0,25.0,
Pork Tenderloin with Maple Glaze ,4.375,153.0,14.0,4.0,56.0,53.0,
Three-Chile Harissa ,0.0,234.0,2.0,21.0,396.0,36.0,
Minted Pineapple-Lime Marmalade ,4.375,1068.0,50.0,93.0,560.0,22.0,
Butter Lettuce and Radish Salad with Lemon-Garlic Vinaigrette ,4.375,155.0,6.0,13.0,290.0,61.0,
Cranberry Kir ,0.0,126.0,0.0,0.0,5.0,70.0,
Celery Root Bisque with Duck Confit and Cracklings ,3.75,249.0,6.0,20.0,127.0,18.0,
Crispy Apple-Oat Fritters ,0.0,247.0,3.0,11.0,250.0,31.0,
Roast Fresh Ham ,3.75,91.0,5.0,4.0,1494.0,74.0,
Cosmopolitan Cocktail ,4.375,139.0,0.0,0.0,12.0,82.0,
Candied Orange Zest ,3.125,260.0,1.0,0.0,2.0,31.0,
Spiced Honey Cake With Cream Cheese Frosting ,4.375,639.0,26.0,47.0,539.0,51.0,
Hue Noodle Soup ,5.0,1793.0,216.0,89.0,1526.0,81.0,
Warm Jasmine Rice Salad with Shrimp and Thai Herbs ,5.0,282.0,8.0,15.0,1513.0,32.0,
Seafood Stew with Fennel and Thyme ,4.375,490.0,57.0,18.0,1659.0,30.0,
Mussel Gratin ,3.125,752.0,11.0,18.0,386.0,81.0,
Chocolate Almond Sherry Cake with Caramelized Pears ,3.75,210.0,5.0,11.0,94.0,53.0,
Candied Butternut Squash ,3.75,226.0,2.0,6.0,202.0,11.0,
Layered Pickled Herring Salad with Tart Apples and Red Onion ,4.375,213.0,9.0,10.0,356.0,24.0,
Sea Scallops with Cilantro Gremolata and Ginger Lime Beurre Blanc ,4.375,2043.0,281.0,90.0,2307.0,32.0,
Peach and Mascarpone Cheesecake with Balsamic Syrup ,3.75,470.0,7.0,31.0,296.0,60.0,
Cantaloupe Raspberry Shake ,0.0,234.0,2.0,1.0,54.0,74.0,
Hot Mexican Cider ,3.75,219.0,0.0,0.0,153.0,35.0,
Sweet-and-Sour Mix II ,5.0,180.0,1.0,0.0,4.0,22.0,
White Onion Soup with Chive Oil ,3.75,183.0,6.0,14.0,140.0,21.0,
Classic Tomato Toast with Mayonnaise and Chives ,5.0,194.0,4.0,12.0,713.0,23.0,
Minted Pea Purée ,4.375,127.0,6.0,5.0,118.0,40.0,
Giant Chocolate Candy Bar With Peanuts and Nougat ,0.0,908.0,8.0,41.0,18.0,36.0,
Mashed Potatoes with Creamy Blue Cheese and Rosemary ,3.75,351.0,15.0,14.0,536.0,46.0,
Sour-Cream Pancakes with Sour-Cream Maple Syrup ,4.375,469.0,7.0,28.0,669.0,55.0,
Muhammara ,4.375,236.0,2.0,22.0,213.0,27.0,
Cappuccino Cheesecake ,4.375,531.0,8.0,21.0,157.0,45.0,
Hoffman House (or Astoria) ,0.0,131.0,0.0,0.0,2.0,24.0,
Seven-Vegetable Couscous with Chunky Onion Harissa ,1.25,610.0,7.0,3.0,3836.0,88.0,
Steamed Egg Custard with Blue Crab and Flowering Chives ,3.75,110.0,11.0,6.0,701.0,51.0,
Warm Orange and Mushroom Spinach Salad ,5.0,598.0,10.0,40.0,115.0,76.0,
Bean Thread Noodles with Pickled Vegetables ,4.375,514.0,10.0,28.0,1473.0,75.0,
Blueberry Lemon Cream Tarts ,4.375,230.0,2.0,16.0,206.0,18.0,
Salsa Verde (Caper and Parsley Sauce) ,4.375,506.0,2.0,54.0,512.0,42.0,
Potato and Blue Cheese Gratin ,3.75,378.0,7.0,25.0,453.0,31.0,
Fresh Country Pork Sausage with Pepper and Sage ,3.75,180.0,7.0,17.0,260.0,91.0,
Little Devil ,5.0,128.0,0.0,0.0,1.0,77.0,
Parmesan-Pepper Biscuits ,4.375,61.0,3.0,4.0,79.0,35.0,
Thai-Style Iced Tea ,5.0,141.0,2.0,8.0,31.0,55.0,
Poached Peaches with Vanilla ,3.125,185.0,1.0,0.0,4.0,89.0,
Pork Chops with Mustard Crumbs ,4.375,1786.0,140.0,118.0,1245.0,72.0,
Mustard Seed-Crusted Salmon with Mustard Cream Sauce ,4.375,528.0,12.0,24.0,63.0,47.0,
Peach and Pistachio Frangipane Tart ,3.125,422.0,8.0,23.0,100.0,42.0,
Lemon Tea Cake with Blueberry-Red Wine Sauce ,4.375,565.0,40.0,27.0,963.0,14.0,
Octopus with Linguine ,4.375,591.0,48.0,39.0,2102.0,53.0,
Prosciutto-Wrapped Asparagus with Mint Dressing ,4.375,80.0,7.0,4.0,544.0,45.0,
Asian Spinach Salad ,4.375,321.0,7.0,25.0,997.0,86.0,
Picnic Meat Loaf ,1.25,393.0,25.0,29.0,248.0,17.0,
Greek-Style Shrimp ,3.75,412.0,27.0,23.0,2492.0,52.0,
Creamy Chia Coconut Ginger-Carrot Soup ,5.0,304.0,6.0,25.0,486.0,70.0,
Shrimp and Crab Gumbo ,4.375,353.0,39.0,7.0,1662.0,32.0,
Beef and Pork Stew (Marosszeki Heranytokany) ,4.375,603.0,29.0,18.0,599.0,64.0,
Black and Tan Sauces ,3.75,1093.0,18.0,55.0,614.0,12.0,
Peanut Butter Banana Cream Pie ,4.375,537.0,10.0,23.0,402.0,18.0,
Sugar Snap Salad ,4.375,111.0,4.0,7.0,26.0,34.0,
Cinnamon Hot Chocolate ,0.0,291.0,10.0,13.0,133.0,40.0,
Three-Nut Pie with Cranberries ,4.375,456.0,5.0,26.0,237.0,68.0,
Chickpea Purée ,3.75,248.0,0.0,27.0,321.0,79.0,
Spicy Lemon Crab Cakes on Mixed Greens ,4.375,494.0,24.0,35.0,965.0,30.0,
Pasta alla Norma ,3.75,677.0,8.0,61.0,298.0,53.0,
Ratatouille Sandwich ,0.0,89.0,3.0,2.0,164.0,20.0,
Fricassee of Game Hen with Creamy Leeks and Vadoum ,3.75,1074.0,83.0,72.0,3268.0,26.0,
Tostadas ,0.0,84.0,1.0,4.0,11.0,93.0,
Hickory-Grilled Rib-Eye Steaks with Bacon-Molasses Butter ,4.375,1162.0,37.0,106.0,2498.0,99.0,
Smoky Mountain Wilted Lettuce ,5.0,218.0,9.0,18.0,434.0,45.0,
Grilled Ground Lamb Kebabs with Fresh Hot-Pepper Paste ,4.375,166.0,8.0,13.0,187.0,39.0,
Onion and Barley Soup with Swiss Cheese Flan ,4.375,633.0,36.0,51.0,247.0,46.0,
Garlic and Rosemary Stuffed Mushrooms ,3.75,229.0,6.0,14.0,155.0,22.0,
Fruited Chili Sauce ,5.0,344.0,4.0,1.0,893.0,39.0,
Crunchy Eggs with Piquillo Peppers ,4.375,1763.0,140.0,115.0,858.0,59.0,
Rice Pilaf with Pistachios and Golden Raisins ,4.375,282.0,8.0,11.0,123.0,61.0,
Arizona Cheese Strata ,4.375,536.0,26.0,33.0,961.0,39.0,
Fig and Sesame Tart with Cardamom Orange Cream ,3.75,488.0,7.0,26.0,116.0,81.0,
Grilled Sardine Tartines with Onion and Arugula ,4.375,555.0,39.0,39.0,562.0,52.0,
Rib-Eye Steak with Blue Cheese Butter and Walla Walla Onion Rings ,4.375,891.0,29.0,64.0,972.0,89.0,
Maple Custard Cups ,4.375,193.0,5.0,12.0,159.0,76.0,
White-Chocolate Bread Pudding with Poached Cherries ,1.25,579.0,38.0,35.0,600.0,85.0,
Strawberry Passion-Fruit Sables ,4.375,1341.0,66.0,42.0,2100.0,96.0,
Orange Currant Scones ,4.375,390.0,7.0,17.0,379.0,33.0,
Roast Pork Loin with Pickled Caramelized Guavas ,4.375,884.0,44.0,38.0,6052.0,40.0,
Red-Braised Pork with Fresh Pineapple ,3.125,516.0,41.0,31.0,653.0,24.0,
Sloeberry ,0.0,222.0,0.0,0.0,6.0,44.0,
Creamy Fettuccine with Bacon ,4.375,1802.0,65.0,78.0,490.0,54.0,
Chinese-Style Rice ,3.75,322.0,6.0,1.0,8.0,49.0,
Raspberry Almond Lattice Tart ,4.375,310.0,4.0,17.0,63.0,50.0,
Quick Apple Küchen ,3.125,508.0,4.0,22.0,511.0,50.0,
Winter Tomato Sauce ,3.75,118.0,3.0,7.0,488.0,85.0,
Strawberries with Marsala ,5.0,53.0,1.0,0.0,1.0,69.0,
Mexican Chocolate Soufflé Cakes ,4.375,464.0,6.0,34.0,85.0,84.0,
Chipotle Sangrita ,0.0,71.0,1.0,0.0,40.0,45.0,
Mexican Street Corn ,4.375,78.0,3.0,7.0,180.0,20.0,
Soy-Basted Chicken Kebabs With Sesame-Citrus Sprinkle ,4.375,477.0,26.0,29.0,1308.0,64.0,
Roasted Cauliflower and Radicchio Salad ,5.0,249.0,6.0,21.0,277.0,54.0,
Buttered Polenta ,5.0,213.0,3.0,8.0,612.0,79.0,
Anchovy Lemon Dip with Green Beans ,4.375,228.0,6.0,19.0,448.0,18.0,
Pork Braised in Dark Soy Sauce ,4.375,452.0,27.0,33.0,220.0,49.0,
Rice with Almonds and Raisins ,3.75,382.0,8.0,10.0,595.0,31.0,
Smoky Red-Lentil Soup with Cheddar Toasts ,4.375,298.0,16.0,13.0,576.0,100.0,
Soba with Chicken and Peanut Sauce ,4.375,882.0,45.0,71.0,6046.0,73.0,
Claret Cobbler ,0.0,113.0,0.0,0.0,0.0,75.0,
Spinach-Bacon Roll-Ups ,4.375,68.0,2.0,5.0,146.0,24.0,
Crème Fraîche Cheesecake with Honey-Rum-Roasted Pineapple ,4.375,504.0,6.0,32.0,362.0,66.0,
Quinoa and Sweet Potato Bakes ,4.375,530.0,36.0,35.0,1258.0,55.0,
New Wave-New Fave Baked Tofu or Tempeh ,3.75,176.0,6.0,7.0,922.0,52.0,
Chocolate Mint Chip Parfait ,1.875,459.0,4.0,25.0,38.0,76.0,
Horseradish Coleslaw ,1.875,153.0,1.0,10.0,241.0,28.0,
Steamed Rice ,2.5,201.0,3.0,3.0,268.0,73.0,
Lobster Salad with Summer Vegetables ,4.375,419.0,50.0,14.0,1209.0,32.0,
Turkey Chili ,4.375,798.0,14.0,53.0,149.0,39.0,
Three-Bean Salad with Olives ,4.375,157.0,3.0,11.0,119.0,39.0,
Spicy Tamarind Shrimp ,2.5,161.0,5.0,11.0,1028.0,82.0,
Hermit Bars ,4.375,109.0,1.0,5.0,81.0,57.0,
Orange Blossom Cheesecake with Raspberry and Pomegranate Sauce ,4.375,945.0,13.0,79.0,952.0,21.0,
Chinese Trinidadian Stir-Fried Shrimp with Rum ,3.75,344.0,36.0,7.0,2374.0,30.0,
Chocolate Mint Layer Cake with Mint Cream Cheese Frosting ,3.75,1023.0,105.0,45.0,1484.0,77.0,
Crab-Stuffed Deviled Eggs ,3.75,71.0,6.0,5.0,129.0,56.0,
Apple Upside-Down Biscuit Cake ,4.375,269.0,3.0,12.0,304.0,11.0,
Shrimp Bisque with Pernod ,4.375,184.0,11.0,8.0,1050.0,20.0,
Harissa Sauce ,5.0,240.0,2.0,21.0,7.0,30.0,
Spiced Carrot and Zucchini Quinoa ,3.75,241.0,7.0,10.0,169.0,51.0,
Karo Classic Pecan Pie ,5.0,4149.0,31.0,446.0,684.0,22.0,
Cocoa-Spice Meringues with Chocolate Cream ,4.375,541.0,44.0,31.0,1510.0,54.0,
Egg Salad and Green Bean Sandwiches ,2.5,367.0,17.0,21.0,450.0,62.0,
Creamy Rosemary Turkey and Vegetable Potpie with Herbed Dumplings ,4.375,428.0,35.0,17.0,611.0,66.0,
Chinese-Style Roast Chicken Thighs ,3.75,544.0,11.0,32.0,112.0,74.0,
Grilled Lamb with Lima Bean Skordalia ,5.0,1114.0,1.0,111.0,5.0,52.0,
Maple Apple Pandowdy with Dried Cranberries ,4.375,203.0,1.0,3.0,101.0,81.0,
Green Pea Ravioli in Lemon Broth ,4.375,400.0,17.0,7.0,902.0,70.0,
Lime and Chile Sauce ,3.75,30.0,1.0,0.0,621.0,28.0,
Turkey Sausage and Vegetable Frittata Sandwich ,3.75,306.0,22.0,20.0,461.0,70.0,
Lentil Croquettes with Watercress and Kefir ,0.0,435.0,9.0,32.0,1664.0,91.0,
Veal Chops with Sherry Gastrique and Roasted Peperonata ,5.0,154.0,2.0,5.0,35.0,71.0,
Salmon Wrapped Poached Eggs ,4.375,389.0,25.0,29.0,664.0,19.0,
Cayenne Corn Bread Sticks ,4.375,165.0,5.0,7.0,315.0,14.0,
Béarnaise Sauce ,5.0,235.0,1.0,26.0,8.0,98.0,
Seared Rainbow Chard with Leeks ,4.375,97.0,2.0,8.0,463.0,25.0,
Garlic Baguette Crumbs ,0.0,95.0,1.0,7.0,103.0,78.0,
Brandy Milk Punch ,0.0,262.0,8.0,8.0,105.0,24.0,
Spinach and Lentil Soup ,4.375,202.0,13.0,6.0,1043.0,28.0,
Swiss Chard and Herb Tart ,4.375,656.0,8.0,41.0,294.0,78.0,
Sunday Frittata with Frizzled Leeks ,4.375,314.0,18.0,23.0,344.0,87.0,
Fish in Pine Nut Sauce ,3.75,243.0,19.0,14.0,474.0,49.0,
Big Apple Pancake ,4.375,645.0,49.0,47.0,578.0,35.0,
Herb-Crusted Grilled Lamb with Apricot Relish ,4.375,709.0,28.0,49.0,1224.0,55.0,
Lemon Ice Cream with Candied Lemon Peel ,3.125,238.0,4.0,15.0,194.0,92.0,
Cauliflower Purée and Caviar on Cloverleaf Potato Chips ,4.375,29.0,1.0,1.0,50.0,74.0,
Oven-Roasted Sea Bass with Ginger and Lime Sauce ,4.375,281.0,33.0,15.0,777.0,51.0,
Root Beer Baked Beans ,3.125,310.0,14.0,7.0,1061.0,25.0,
Chopped Vegetable Salad with Feta and Olives ,4.375,249.0,6.0,22.0,382.0,74.0,
Tangy Avocado-Orange Salad ,3.75,111.0,2.0,5.0,11.0,41.0,
Braised Veal with Gremolata ,4.375,318.0,42.0,13.0,151.0,83.0,
Indian-Spiced Chicken With Tomato and Cream ,3.75,770.0,51.0,52.0,614.0,51.0,
Perfect Grass-Fed Beef Burgers ,1.25,394.0,34.0,26.0,765.0,57.0,
Porcini-Rubbed Beef Rib Roast ,4.375,1577.0,43.0,18.0,3340.0,68.0,
Tomato-Rubbed Bruschetta ,3.75,155.0,2.0,11.0,126.0,62.0,
Grilled Chili-Rubbed Lamb Chops ,3.75,889.0,50.0,28.0,1918.0,17.0,
"Grilled Scallop ""Ceviche"" ",5.0,160.0,14.0,7.0,835.0,66.0,
Beet Salad with Ricotta Salata and Black Olive Croutons ,4.375,191.0,6.0,10.0,373.0,16.0,
