Title,Rating,Calories,Protein,Fat,Sodium,Price
Peach Mustard ,3.125,134.0,4.0,3.0,1394.0,61.0,
Mexican Hot Chocolate II ,3.75,396.0,10.0,21.0,124.0,75.0,
Beef Braised in Red Wine ,5.0,1049.0,124.0,45.0,1671.0,53.0,
Raspberry Tart May ,4.375,272.0,4.0,15.0,79.0,80.0,
Cornmeal Biscuits with Chorizo Gravy and Scallions ,3.75,1208.0,50.0,78.0,2560.0,79.0,
Honeydew and Cantaloupe Mousse ,3.125,300.0,6.0,2.0,114.0,83.0,
Tarragon-Cilantro Salsa Verde ,3.75,128.0,1.0,14.0,120.0,22.0,
Brazen Hussy ,0.0,155.0,0.0,0.0,3.0,67.0,
King of Snake Cocktail ,5.0,173.0,0.0,0.0,14.0,19.0,
Frozen Yogurt Banana Splits ,3.75,372.0,6.0,6.0,130.0,69.0,
Horseradish Dill Potato Salad ,4.375,298.0,6.0,12.0,199.0,91.0,
Orange-Tini ,3.75,84.0,0.0,0.0,5.0,31.0,
Tropical Fruit Crepes with Vanilla Bean and Rum Butter Sauce ,5.0,487.0,6.0,25.0,299.0,42.0,
Tricolor Tomato Fettuccine ,4.375,867.0,47.0,58.0,386.0,84.0,
Grilled Cheese with Smoked Turkey and Avocado ,4.375,596.0,14.0,51.0,361.0,58.0,
"""California Roll"" Salad ",4.375,369.0,9.0,13.0,953.0,67.0,
Bacon and Egg Sandwiches with Pickled Spring Onions ,3.75,884.0,14.0,40.0,201.0,65.0,
Hot and Sticky Apricot-Glazed Chicken ,4.375,972.0,48.0,63.0,2798.0,22.0,
Gratineed Gnocchi with Spinach and Ricotta ,3.75,338.0,14.0,14.0,731.0,91.0,
Beef Tenderloin Steaks Stuffed with Morels ,3.75,877.0,56.0,49.0,2532.0,82.0,
Fried Ricotta and Mozzarella Dumplings with Broccoli Sauce ,4.375,641.0,8.0,37.0,234.0,79.0,
Frenchy's Pasties ,0.0,835.0,35.0,70.0,1143.0,89.0,
Turkey Stock ,0.0,345.0,51.0,14.0,266.0,16.0,
Cream of Tomato Soup with Souffléed Cheese Toasts ,3.75,195.0,8.0,11.0,237.0,68.0,
Tropical Fruit Splits with Rum Sauce and Chile-Macadamia Brittle ,5.0,645.0,38.0,42.0,263.0,85.0,
Tartar Sauce ,5.0,152.0,0.0,17.0,182.0,33.0,
Spaghetti with Fresh Tomato and Herbs ,0.0,683.0,48.0,46.0,439.0,33.0,
Halibut with Sambal Vinaigrette and Wasabi Cream ,4.375,417.0,43.0,26.0,257.0,86.0,
Cod with Mushroom-Herb Crust and Tomato Compote ,1.875,861.0,4.0,90.0,703.0,79.0,
Individual Blueberry-Coconut Pound Cakes ,3.75,641.0,25.0,26.0,353.0,62.0,
Deviled Potato Salad ,4.375,415.0,7.0,24.0,536.0,94.0,
Honey-Cheese Pie with Strawberry Compote ,5.0,533.0,11.0,28.0,343.0,14.0,
Haroseth (Dried Fruit and Nut Paste) ,4.375,612.0,8.0,32.0,428.0,28.0,
Roasted Almonds with Rosemary Fleur de Sel ,3.75,225.0,8.0,19.0,372.0,58.0,
Wild Mushroom Lasagne ,4.375,998.0,50.0,53.0,2409.0,97.0,
Sweet Potato Salad with Chili-Lime Dressing ,3.75,271.0,3.0,12.0,500.0,38.0,
Charred Green Beans with Lemon Verbena Pesto ,4.375,827.0,57.0,57.0,870.0,73.0,
Smoked Chicken Salad on Toasted Corn Bread Triangles ,4.375,47.0,2.0,4.0,25.0,24.0,
Chocolate-Cherry Ice Cream Pie with Hot Fudge Sauce ,3.75,657.0,19.0,58.0,532.0,76.0,
Tomatoes Stuffed with Bulgur and Pine Nuts ,4.375,313.0,8.0,18.0,683.0,96.0,
Hearts of Romaine with Blue Cheese and Caper Dressing ,3.125,363.0,8.0,36.0,517.0,10.0,
Chocolate-Almond Torte ,4.375,392.0,10.0,30.0,146.0,59.0,
Buttermilk Panna Cotta with Tropical Fruit ,4.375,170.0,4.0,7.0,172.0,70.0,
Tortillas in Black Bean Sauce ,3.75,651.0,5.0,24.0,249.0,39.0,
Whiskey Sour ,0.0,203.0,0.0,0.0,13.0,80.0,
Fig Leaf ,0.0,108.0,0.0,0.0,3.0,49.0,
Honey-Ginger Barbecue Sauce ,4.375,298.0,1.0,0.0,1430.0,65.0,
Gingerbread Layer Cake with Candied Kumquats ,3.75,866.0,127.0,32.0,4646.0,92.0,
Cornmeal-Crusted Soft-Shelled Crabs with Cilantro-Lime Tartar Sauce ,3.75,4256.0,101.0,119.0,7072.0,68.0,
Lemon Verbena Ice Cream ,5.0,169.0,4.0,11.0,26.0,34.0,
Deep Chocolate Torte with Coffee Buttercream ,4.375,320.0,5.0,20.0,50.0,85.0,
Hot Fudge Sauce ,4.375,685.0,55.0,50.0,177.0,62.0,
Pomegranate and Fennel Glazed Rack of Lamb ,5.0,396.0,15.0,36.0,60.0,71.0,
Carrots and Rutabagas with Lemon and Honey ,4.375,169.0,2.0,8.0,65.0,39.0,
French Spiced Bread ,5.0,366.0,9.0,5.0,667.0,36.0,
Grilled Brown-Sugar Peaches with White Chocolate ,4.375,280.0,3.0,21.0,16.0,80.0,
Roasted Sweet Potato Wedges with Smoked Chile Cream ,4.375,283.0,4.0,10.0,132.0,28.0,
Gingery Watermelon Paletas ,5.0,90.0,2.0,1.0,29.0,90.0,
Broiled Swordfish à la Niçoise ,4.375,609.0,38.0,31.0,243.0,37.0,
Avocado-Lime Ice Pops ,0.0,259.0,2.0,10.0,56.0,23.0,
Sweet-and-Spicy Mixed Nuts ,5.0,305.0,7.0,26.0,245.0,74.0,
Kim’s Black-Eyed Pea Dip ,0.0,267.0,13.0,15.0,673.0,63.0,
Cranberry Granita with Orange Whipped Cream ,3.75,285.0,1.0,5.0,28.0,86.0,
Mini Buffalo Chicken Balls ,4.375,213.0,12.0,15.0,483.0,25.0,
Spinach with Sour Cream and Toasted Pine Nuts ,3.75,157.0,7.0,11.0,184.0,87.0,
Swiss Chard Gratin ,4.375,331.0,14.0,20.0,794.0,61.0,
Grilled Green Bean Salad with Red Onions and Tomatoes ,4.375,196.0,3.0,15.0,12.0,67.0,
Lemon Zucchini Vichyssoise ,3.75,176.0,5.0,11.0,57.0,29.0,
Baba ,3.75,887.0,21.0,83.0,64.0,23.0,
Chicken Laap ,4.375,272.0,25.0,13.0,429.0,69.0,
Carolina Mustard Sauce ,4.375,205.0,2.0,2.0,749.0,99.0,
Froth Blower ,0.0,73.0,2.0,0.0,29.0,23.0,
Poulet au Vinaigre a l'Estragon ,3.75,693.0,23.0,47.0,452.0,55.0,
Chawan Mushi with Shrimp and Spring Peas ,4.375,87.0,7.0,3.0,133.0,48.0,
Avgolemono ,3.75,185.0,8.0,4.0,346.0,41.0,
Roast Koji Chicken ,0.0,937.0,14.0,76.0,709.0,64.0,
Coconut-Chocolate Marjolaine ,5.0,612.0,20.0,39.0,582.0,19.0,
Belgian Ale-Braised Brisket ,3.75,759.0,43.0,63.0,262.0,98.0,
Crispy Garlic Risotto Cakes ,3.75,238.0,4.0,11.0,75.0,85.0,
Bourbon Barbecue Sauce ,4.375,252.0,2.0,1.0,1317.0,16.0,
Blueberry Bishop ,5.0,295.0,1.0,1.0,6.0,35.0,
Spice-Rubbed Cornish Hens with Haroseth Stuffing and Sherry Jus ,5.0,793.0,31.0,64.0,939.0,49.0,
Zesty Halibut in Soy-Ginger Dressing ,3.75,285.0,45.0,4.0,307.0,40.0,
Spiced Nuts ,3.75,270.0,3.0,21.0,279.0,90.0,
Goat Cheese Souffles and Mixed Greens with Raspberry Vinaigrette ,4.375,256.0,17.0,18.0,473.0,45.0,
Lasagne Rolls with Roasted Tomato and Eggplant ,3.125,698.0,51.0,53.0,1083.0,66.0,
Taiwanese Beef Noodle Soup ,5.0,1550.0,41.0,120.0,3070.0,20.0,
Soft Egg Ravioli ,3.75,956.0,17.0,61.0,129.0,29.0,
Lamb and Shiitake Stew with Tomato-Chianti Sauce ,4.375,383.0,30.0,10.0,160.0,12.0,
Brown Rice and Barley ,4.375,284.0,7.0,2.0,10.0,16.0,
Herb-Roasted Turkey ,5.0,1152.0,15.0,120.0,607.0,11.0,
Mango Gingerbread with Macadamia Streusel ,4.375,326.0,6.0,11.0,336.0,79.0,
Pork and Noodle Soup with Shiitake and Snow Cabbage ,3.75,520.0,13.0,35.0,246.0,94.0,
Herb-Roasted Turkey with Shallot Pan Gravy ,3.75,1243.0,37.0,118.0,1944.0,54.0,
Salmon with Lentils and Mustard-Herb Butter (Saumon aux Lentilles) ,3.75,742.0,20.0,33.0,345.0,28.0,
Sticky Date and Almond Bread Pudding with Amaretto Zabaglione ,3.75,568.0,6.0,37.0,81.0,58.0,
Hunan Lamb Chops ,5.0,926.0,69.0,59.0,608.0,46.0,
Potatoes with Parsley and Green Onions ,4.375,346.0,6.0,19.0,59.0,19.0,
Spinach and Leek Gratin with Roquefort Crumb Topping ,4.375,483.0,13.0,33.0,579.0,51.0,
Lady Peas with Salt Pork and Rice ,3.75,1909.0,65.0,165.0,1693.0,63.0,
Pickled Vegetables ,5.0,296.0,13.0,3.0,736.0,28.0,
Peppery Pasta with Feta Cheese ,4.375,464.0,17.0,14.0,425.0,72.0,
Grilled Steak and Potatoes with Charmoula Sauce ,4.375,598.0,31.0,18.0,1042.0,60.0,
Tadka Dhal ,3.125,144.0,2.0,11.0,41.0,60.0,
Mango-Pineapple Tart with Macadamia Nut Crust ,4.375,377.0,5.0,23.0,74.0,47.0,
Sauteed Broccoli Rabe and Peas. ,3.75,202.0,7.0,14.0,401.0,66.0,
Fig and Stilton Salad with Port Wine Dressing ,3.75,271.0,5.0,19.0,242.0,90.0,
Roasted Butternut Squash with Lime Juice ,4.375,213.0,3.0,11.0,11.0,44.0,
Orange-Rosemary Chicken ,3.75,2378.0,87.0,201.0,341.0,49.0,
Sausage Stew ,3.75,734.0,40.0,49.0,280.0,16.0,
Beef Tenderloin with Port-Balsamic Sauce ,4.375,941.0,12.0,51.0,340.0,90.0,
Roast Beef Wraps with Horseradish Coleslaw ,3.75,345.0,27.0,16.0,276.0,99.0,
Boursin and Bacon on Cracked Pepper Bread ,4.375,767.0,9.0,43.0,304.0,100.0,
Veal Scaloppine with Mushroom Cream Sauce ,3.75,416.0,27.0,18.0,141.0,70.0,
Caramel Corn Blondies ,5.0,271.0,8.0,19.0,71.0,30.0,
Grilled Balsamic-Marinated London Broil with Red Onions ,4.375,428.0,39.0,24.0,105.0,27.0,
Meatballs with Bulgur in Onion and Tomato Sauce (Voli Me Plyguri) ,3.75,508.0,29.0,31.0,541.0,52.0,
Whole Wheat Pancake and Waffle Mix ,3.75,827.0,10.0,51.0,890.0,81.0,
Corn and Lobster Chowder ,4.375,506.0,29.0,26.0,1117.0,20.0,
Lamb Stew Ciuba ,4.375,2330.0,31.0,94.0,992.0,20.0,
Cranberry Black Pepper Chutney ,4.375,153.0,1.0,3.0,149.0,62.0,
Steamed New Potatoes with Mint and Parsley ,3.75,183.0,3.0,7.0,35.0,13.0,
Spiced Shallots and Prunes ,0.0,317.0,5.0,0.0,25.0,56.0,
Mussels with Fennel and Roasted Red Pepper Butter ,4.375,334.0,25.0,16.0,732.0,73.0,
Frozen Plum Souffles with Cardamom-Plum Sauce ,4.375,1201.0,11.0,49.0,613.0,72.0,
Homemade Herbed Paneer Cheese ,5.0,205.0,8.0,13.0,1186.0,76.0,
Escolar Fish with Mango and Shrimp Ravioli ,3.75,5221.0,59.0,312.0,832.0,11.0,
Cream of Cauliflower and Stilton Soup ,4.375,307.0,10.0,20.0,1031.0,43.0,
Summer Fruit Terrine ,4.375,744.0,33.0,30.0,777.0,14.0,
Pancetta Roast Chicken with Walnut Stuffing ,3.125,1202.0,31.0,87.0,617.0,23.0,
Chicken Vesuvio ,3.75,1855.0,83.0,148.0,1822.0,91.0,
Champagne Punch ,4.375,251.0,0.0,0.0,13.0,56.0,
Fennel-Celery Salad With Blue Cheese and Walnuts ,0.0,193.0,4.0,15.0,233.0,83.0,
Cheese Blintzes ,3.75,195.0,14.0,8.0,388.0,31.0,
Panfried Black Bean Coriander Cakes ,3.75,1080.0,70.0,75.0,632.0,22.0,
Malaysian-Style Chicken Curry ,3.75,1227.0,80.0,83.0,659.0,53.0,
Fried Chicken Salad ,4.375,4777.0,248.0,382.0,1871.0,25.0,
Potato Gratin with Cream and Fresh Herbs ,4.375,472.0,8.0,36.0,341.0,83.0,
Grilled-Fish Tacos ,3.125,547.0,20.0,32.0,452.0,95.0,
Greens and Grains Scramble ,5.0,335.0,15.0,24.0,1068.0,84.0,
Three-Onion Sauté ,0.0,139.0,1.0,9.0,86.0,51.0,
Cheese and Hominy Quesadillas with Tropical Salsa ,4.375,508.0,22.0,25.0,939.0,68.0,
Roasted Bosc Pears ,0.0,171.0,0.0,13.0,2.0,86.0,
All-American Peppermint Stick Torte with Fudge Topping ,4.375,634.0,35.0,42.0,95.0,19.0,
Roquefort and Toasted Pecan Dressing ,3.75,441.0,11.0,43.0,706.0,36.0,
Cranberry Sauce with Port and Cinnamon ,4.375,210.0,0.0,1.0,6.0,29.0,
Toasted Nut Tart ,4.375,555.0,14.0,23.0,176.0,10.0,
Sauteed Radishes and Watercress ,3.75,116.0,3.0,9.0,533.0,41.0,
Chicken Vindaloo ,5.0,892.0,28.0,75.0,731.0,47.0,
Thai Spareribs ,5.0,1453.0,107.0,106.0,732.0,30.0,
Marinated Vegetables with Garlic and Thyme ,4.375,345.0,5.0,28.0,461.0,93.0,
Deviled Ham ,3.125,185.0,10.0,13.0,765.0,49.0,
Minted Simple Syrup ,4.375,209.0,1.0,0.0,13.0,36.0,
Kashmiri Chai with Gin ,5.0,213.0,5.0,6.0,133.0,17.0,
Loudspeaker ,0.0,122.0,0.0,0.0,1.0,81.0,
Lemon Buttermilk Pie ,4.375,258.0,4.0,14.0,160.0,72.0,
Corn Chive Pudding ,4.375,253.0,8.0,11.0,429.0,32.0,
Curried Beef and and Sugar Snap Peas Over Rice Noodles ,3.75,924.0,74.0,60.0,1061.0,25.0,
Toasted Israeli Couscous with Pine Nuts and Parsley ,4.375,260.0,8.0,11.0,223.0,95.0,
German-Style Potato and Ham Salad ,4.375,410.0,14.0,19.0,1060.0,38.0,
Roasted Winter Squash and Parsnips with Maple Syrup Glaze and Marcona Almonds ,4.375,289.0,5.0,14.0,306.0,34.0,
Broccoli Slaw with Miso-Ginger Dressing ,3.75,97.0,4.0,5.0,466.0,60.0,
Fried Chick-Pea Sandwiches with Coriander Yogurt ,4.375,1443.0,100.0,106.0,1316.0,14.0,
Steamed Mussels with Tomato and Chorizo Broth ,5.0,25.0,2.0,1.0,65.0,42.0,
Potato Silk with Truffle Oil ,3.125,339.0,8.0,17.0,66.0,91.0,
Blueberry Lemon Corn Muffins ,4.375,853.0,12.0,55.0,768.0,94.0,
Mussels in Romesco Sauce ,3.125,329.0,16.0,23.0,368.0,71.0,
Buttermilk Fried Shrimp ,4.375,897.0,51.0,71.0,957.0,72.0,
Mango and Red Onion Salsa ,4.375,94.0,2.0,1.0,4.0,16.0,
Roast Pork Tenderloins with Cranberry-Port Sauce ,4.375,430.0,37.0,16.0,548.0,88.0,
Breakfast Cookies ,4.375,134.0,3.0,6.0,190.0,33.0,
Parsley-Root Soup with Truffled Chestnuts ,3.75,237.0,7.0,14.0,313.0,84.0,
Smoke in Da Eye Grilled Coffee-Coriander-Rubbed New York Strip Steak ,3.125,814.0,35.0,67.0,184.0,12.0,
Coconut and Pistachio Baklava ,0.0,301.0,3.0,19.0,124.0,98.0,
Chipotle-Sesame Chicken Skewers ,3.75,42.0,4.0,2.0,68.0,100.0,
Warm Frisée Salad with Fingerlings and Bacon ,5.0,402.0,10.0,32.0,843.0,37.0,
Mussels with Coconut Curry Sauce ,4.375,253.0,15.0,16.0,334.0,81.0,
Roasted Garlic-Balsamic Steak Sauce ,3.75,102.0,1.0,0.0,43.0,37.0,
Crispy Chicken Sandwich with Buttermilk Slaw and Herbed Mayo ,4.375,2442.0,69.0,229.0,2157.0,52.0,
Beef Steaks with Peppercorn Sauce ,5.0,610.0,8.0,32.0,431.0,11.0,
Red Bell Pepper and Cheddar Cheese Salad ,3.75,146.0,8.0,11.0,173.0,24.0,
Grilled Roast Beef and Stilton Sandwich ,3.75,640.0,34.0,45.0,1325.0,39.0,
Chive-Goat Cheese Spread ,3.75,129.0,6.0,11.0,190.0,11.0,
Blueberry-Nectarine Crisp ,4.375,409.0,4.0,12.0,8.0,75.0,
Spiced Peaches and Raspberries ,0.0,91.0,1.0,0.0,3.0,26.0,
Green Tea Panna Cotta with Strawberries ,4.375,147.0,3.0,7.0,27.0,14.0,
Absinthe's Golden Yogurt Cake ,3.75,3914.0,50.0,228.0,1875.0,11.0,
Green Salad with Oil and Vinegar Dressing (Salade Verte à la Vinaigrette) ,4.375,129.0,1.0,14.0,141.0,40.0,
Spicy Sichuan Tofu (Mapo Doufu) ,4.375,238.0,20.0,14.0,473.0,90.0,
Spiced Cherry Cider with Kirsch Cream ,5.0,195.0,1.0,3.0,15.0,67.0,
Holiday Fruit-Filled Pound Cake ,3.75,546.0,12.0,10.0,20.0,53.0,
Italian Chicken Salad ,2.5,821.0,69.0,52.0,641.0,35.0,
Shoe String Potatoes (Pommes Pailles) ,5.0,360.0,4.0,26.0,9.0,95.0,
Pork Stew with Olives and Green Beans ,4.375,1243.0,175.0,52.0,2400.0,14.0,
Cardamom Rice Pudding (Payasam) ,3.75,417.0,11.0,14.0,162.0,73.0,
Mushroom Crepes with Poblano Chile Sauce ,4.375,825.0,46.0,49.0,912.0,10.0,
Rich and Sticky Gingerbread with Marmalade ,3.75,201.0,2.0,6.0,165.0,76.0,
Black and White Crème Brûlée ,3.75,304.0,4.0,23.0,25.0,82.0,
Chicken and Green Onion Cobbler ,4.375,717.0,18.0,23.0,1650.0,82.0,
Broiled Arctic Char with Basil Sauce and Tomato ,4.375,784.0,7.0,52.0,263.0,68.0,
Seafood Risotto (Risotto ai Fruitti di Mare) ,4.375,799.0,64.0,9.0,762.0,88.0,
Chicken with Tomatoes and Prunes ,4.375,940.0,52.0,67.0,650.0,39.0,
Hot Spiced Beer ,0.0,251.0,1.0,0.0,10.0,46.0,
Chicken Milanesa With Maggi Ranch Sauce ,3.125,1149.0,86.0,38.0,520.0,16.0,
Chocolate-Walnut Brownies ,4.375,215.0,3.0,14.0,63.0,31.0,
Mango Cucumber Salsa ,3.75,103.0,2.0,2.0,3.0,75.0,
Roasted Sweet Potatoes & Fresh Figs ,5.0,1334.0,103.0,78.0,551.0,63.0,
Dorade With Potatoes and Burst Tomato Sauce ,5.0,498.0,44.0,22.0,229.0,36.0,
Chocolate Mousse Cake with Cinnamon Cream ,4.375,258.0,4.0,19.0,36.0,98.0,
Indonesian Fried Noodles ,3.75,889.0,26.0,57.0,350.0,72.0,
Crispy Curry-Roasted Chickpeas ,3.125,239.0,10.0,9.0,667.0,41.0,
Lemon Thyme Madeleines with Lemon Vodka Syrup ,4.375,118.0,1.0,5.0,47.0,50.0,
Mexican Brownies ,4.375,294.0,4.0,16.0,66.0,40.0,
Cider-Dijon Pork Chops with Roasted Sweet Potatoes and Apples ,0.0,726.0,46.0,57.0,1634.0,80.0,
Beef and Andouille Burgers with Asiago Cheese ,0.0,1097.0,75.0,82.0,442.0,60.0,
Frozen Italian Zabaglione Tart with Marsala-Lemon Sauce ,5.0,749.0,1.0,73.0,937.0,62.0,
Cavatappi with Butternut Squash ,3.75,732.0,37.0,47.0,1103.0,55.0,
Roasted Asparagus and Leek Frittata ,3.125,612.0,8.0,63.0,405.0,100.0,
Soba With Green Chile Pesto ,1.25,142.0,7.0,2.0,571.0,61.0,
Kemp's Pesto ,1.875,193.0,6.0,18.0,288.0,94.0,
Melted Swiss Cheese with Vegetables ,5.0,534.0,27.0,39.0,1124.0,34.0,
Chocolate-Orange Carrot Cake ,4.375,1807.0,82.0,158.0,1072.0,36.0,
Baguette Toasts ,5.0,44.0,1.0,1.0,75.0,19.0,
"Avocado ""Pesto"" ",3.125,354.0,3.0,36.0,37.0,47.0,
Quince-Date Chutney ,5.0,271.0,2.0,1.0,399.0,71.0,
Summer Garden Salad with Chili-Garlic Shrimp ,4.375,279.0,23.0,15.0,1096.0,13.0,
Chicken and Fennel Pie with Bacon-Biscuit Crust ,3.75,833.0,38.0,37.0,1357.0,25.0,
Broccoli-Cheese Soup ,0.0,339.0,13.0,19.0,1230.0,24.0,
Bennett ,0.0,179.0,0.0,0.0,2.0,56.0,
Blue Cheese Dressing ,4.375,593.0,26.0,32.0,598.0,47.0,
Daiquiri ,0.0,97.0,0.0,0.0,7.0,45.0,
Sesame-Lime Vinaigrette ,3.75,550.0,36.0,39.0,632.0,79.0,
Tropical Rum Punch ,5.0,230.0,1.0,0.0,26.0,98.0,
Shrimp and Noodle Stir Fry ,3.125,473.0,21.0,17.0,834.0,31.0,
Passion Fruit Caramel Sauce ,5.0,550.0,13.0,30.0,301.0,53.0,
Shrimp Sates with Spiced Pistachio Chutney ,3.75,23.0,1.0,2.0,4.0,78.0,
Red Wine Sauce ,3.125,139.0,2.0,8.0,416.0,15.0,
Pork Spice Rub ,3.75,62.0,3.0,3.0,3023.0,13.0,
Red Lentil and Tofu Curry ,3.125,481.0,31.0,25.0,622.0,96.0,
Spiced Kabocha Squash Pie with Pumpkin-Seed Crumble ,5.0,261.0,4.0,16.0,166.0,67.0,
Crab Salad with Sun-Dried Tomato Louis Dressing ,3.75,716.0,22.0,62.0,562.0,29.0,
Cowboy Steaks in a Skillet ,3.75,716.0,32.0,24.0,970.0,56.0,
Kaffir Lime Mousse with Honeydew Water ,5.0,299.0,6.0,10.0,83.0,99.0,
Sausage and Tomato Quiche ,4.375,370.0,8.0,28.0,495.0,84.0,
Shrimp Courtbouillon with Rice ,5.0,240.0,30.0,5.0,965.0,98.0,
Smoky Tangy Greens And Beans ,0.0,456.0,19.0,31.0,598.0,92.0,
Quebec Maple Sugar Pie ,4.375,2068.0,14.0,142.0,332.0,78.0,
Broiled Peaches with Crème Fraîche ,3.125,52.0,0.0,0.0,0.0,21.0,
Chocolate-Almond Soufflé Torte ,4.375,714.0,20.0,54.0,1125.0,11.0,
Chicken with Tomatillo Sauce and Braised Fruit ,3.75,1111.0,64.0,17.0,1747.0,92.0,
Stir-Fried Chestnuts and Chinese Cabbage ,3.75,266.0,3.0,9.0,295.0,23.0,
Blackberry-Thyme Margarita ,5.0,242.0,0.0,0.0,35.0,54.0,
Fried-Egg Caesar with Sun-Dried Tomatoes and Prosciutto Breadsticks ,4.375,456.0,24.0,31.0,1383.0,53.0,
Peanut Dacquoise with Peanut Butter Mousse ,3.75,607.0,25.0,44.0,860.0,96.0,
Sweet Garlic Soy Sauce ,2.5,443.0,11.0,1.0,7032.0,72.0,
Madeira Cream Gravy ,4.375,2896.0,348.0,145.0,4503.0,40.0,
Artichokes Basted with Anchovy Butter ,3.75,324.0,11.0,19.0,618.0,98.0,
Isabelle's Semolina Cake ,3.75,474.0,14.0,9.0,128.0,43.0,
Mango Fools with Chocolate-Anise Straws ,3.75,175.0,2.0,11.0,13.0,77.0,
Strawberry Tiramisu ,4.375,750.0,45.0,40.0,387.0,63.0,
Ginger-Marinated Hanger Steak ,4.375,573.0,8.0,27.0,422.0,13.0,
Chipotle Burgers ,4.375,282.0,30.0,7.0,956.0,45.0,
Key Lime Mousse ,4.375,379.0,5.0,28.0,137.0,31.0,
Lemon Syrup Cake with Berries and Lemon-Curd Cream ,2.5,823.0,41.0,63.0,740.0,54.0,
Sweet-Potato Gratins ,3.75,118.0,3.0,7.0,77.0,33.0,
Chicken and Bell Pepper with Onion Confit ,4.375,1014.0,27.0,48.0,984.0,86.0,
Chicken in Red Wine Sauce with Root Vegetables and Wilted Greens ,3.75,1226.0,89.0,80.0,800.0,25.0,
Rustic Plum Pie ,4.375,302.0,3.0,11.0,120.0,17.0,
Pan Fried Potatoes with Paprika and Lemon ,2.5,307.0,6.0,10.0,16.0,41.0,
Curly Endive and Apple Smoked Bacon Salad ,4.375,753.0,46.0,53.0,1204.0,58.0,
Shepherd's Pie with Parsnip Topping ,4.375,675.0,45.0,45.0,3715.0,55.0,
Moroccan Spiced Beef ,3.125,535.0,20.0,43.0,465.0,21.0,
Parsnip Spice Cake with Ginger Cream Cheese Frosting ,4.375,356.0,4.0,14.0,249.0,98.0,
Tarragon and Lemon Roast Chicken ,5.0,1085.0,150.0,44.0,2032.0,95.0,
Roast Rack of Lamb with Mint Sauce ,5.0,491.0,17.0,23.0,677.0,71.0,
Lemon-Whiskey Bundt Cake ,4.375,471.0,5.0,23.0,467.0,80.0,
Spaghetti with Creamy Sun-Dried Tomato Sauce ,4.375,679.0,14.0,41.0,489.0,93.0,
Lemon Blueberry Cupcakes With a Citrus Glaze ,5.0,354.0,5.0,10.0,149.0,37.0,
Buffalo Grilled Shrimp with Blue Cheese Dip and Celery ,1.25,1881.0,57.0,96.0,1157.0,99.0,
Brown-Rice Flour Mix ,5.0,267.0,4.0,1.0,5.0,52.0,
Roast Chicken With Harissa And Schmaltz ,5.0,1246.0,11.0,114.0,234.0,75.0,
Sweet Potato Bread with Caramel and Aleppo-Spiced Pecans ,5.0,320.0,6.0,13.0,315.0,28.0,
Orecchiette with Broccoli Rabe and Fried Chickpeas ,3.125,730.0,4.0,8.0,29.0,93.0,
Chocolate Soufflé ,5.0,357.0,3.0,22.0,19.0,32.0,
Quick Sesame Chicken With Broccoli ,3.75,884.0,67.0,50.0,611.0,80.0,
Chopped Salad ,4.375,327.0,4.0,34.0,144.0,22.0,
Black-Eyed Pea Fritters with Hot Pepper Relish ,4.375,69.0,1.0,6.0,165.0,25.0,
Currant Tea Scones ,4.375,323.0,5.0,14.0,295.0,64.0,
Great-Grandmother's Cloverleaf Rolls ,4.375,242.0,5.0,10.0,209.0,59.0,
Warm Brussels Sprout and Spinach Salad with Bacon ,3.75,168.0,5.0,15.0,165.0,75.0,
Turkey Torta ,5.0,393.0,27.0,11.0,420.0,25.0,
Chia Seed Porridge with Orange & Yogurt ,4.375,198.0,5.0,5.0,28.0,38.0,
Tuscan Tuna Salad with Fennel ,5.0,454.0,23.0,34.0,393.0,23.0,
Sea Bass in Papillote ,4.375,278.0,33.0,14.0,631.0,34.0,
Tree-Trimming Cider Punch ,0.0,348.0,1.0,1.0,28.0,36.0,
Garden Tuna Salad ,3.75,282.0,13.0,13.0,131.0,15.0,
Herb and Cheese Poppers ,4.375,65.0,2.0,5.0,171.0,38.0,
Pan-Seared Cod with Creamy Fennel Ragoût ,4.375,819.0,35.0,42.0,1989.0,33.0,
Spumoni Sundaes with Espresso Hot Fudge Sauce ,5.0,598.0,2.0,1.0,18.0,93.0,
Osso Buco ,5.0,1585.0,15.0,97.0,921.0,67.0,
Classic Escargots à la Bourguignonne ,4.375,168.0,6.0,16.0,26.0,19.0,
Picadillo ,3.125,405.0,27.0,30.0,1271.0,69.0,
Power-Boosting Beets ,5.0,327.0,8.0,6.0,299.0,94.0,
Cantaloupe and Prosciutto with Basil Oil ,4.375,309.0,19.0,23.0,1552.0,27.0,
Chilli Oil ,0.0,411.0,0.0,46.0,1.0,38.0,
Chicken Fried Pork with Milk Gravy ,4.375,1279.0,33.0,62.0,1548.0,74.0,
Penne with Slow-Roasted Cherry Tomatoes and Goat Cheese ,3.75,668.0,55.0,47.0,691.0,13.0,
Curry-Coconut Mussels Babalu's ,4.375,1007.0,38.0,75.0,1293.0,58.0,
Barbecue Pulled-Turkey Sandwiches ,3.75,443.0,26.0,20.0,485.0,86.0,
Peppery Pasta Carbonara with Poached Egg ,3.75,792.0,58.0,51.0,2000.0,61.0,
Andouille-Stuffed Pork Loin with Creole Mustard ,3.75,441.0,40.0,21.0,5865.0,11.0,
Spiced Hazelnut-Pear Cake With Chocolate Sauce ,3.125,329.0,4.0,14.0,204.0,96.0,
Radishes and Scallions ,2.5,75.0,1.0,6.0,51.0,24.0,
Lemon and Salmon Roe Pasta ,2.5,600.0,10.0,36.0,67.0,79.0,
Curried Parsnip Soup with Shredded Apples ,4.375,560.0,26.0,25.0,1213.0,44.0,
Cold Minted Pea and Buttermilk Soup ,3.75,189.0,14.0,3.0,502.0,60.0,
Cranberry-Chipotle Fruit Conserve ,3.75,254.0,1.0,0.0,420.0,55.0,
Bitter Crush ,3.75,162.0,0.0,0.0,3.0,63.0,
Giant Chocolate Caramel Cookie Bars ,0.0,273.0,2.0,15.0,160.0,11.0,
Oranges with Pomegranate Molasses and Honey ,5.0,215.0,2.0,0.0,78.0,89.0,
Cranberry and Pear Chutney ,4.375,236.0,2.0,1.0,85.0,38.0,
Grilled Marinated London Broil ,4.375,524.0,19.0,26.0,536.0,44.0,
Sweet Potatoes and Greens with Honey-Mustard Glaze ,4.375,253.0,4.0,8.0,325.0,49.0,
Caramelized Potatoes ,3.75,137.0,2.0,3.0,492.0,36.0,
Chicken Burritos with Poblano Chiles and Corn ,3.75,563.0,19.0,40.0,1000.0,84.0,
Black Bean Tostadas with Curly Endive Salad ,5.0,630.0,75.0,32.0,518.0,75.0,
Date-Pecan Bourbon Truffles ,2.5,163.0,1.0,11.0,2.0,71.0,
Halibut with Herb Sauce ,3.75,318.0,32.0,20.0,117.0,84.0,
Spinach Soufflé with Roasted Red Pepper Sauce ,4.375,335.0,26.0,17.0,530.0,45.0,
Grilled Leg of Lamb with Thyme and Allspice ,3.125,835.0,48.0,46.0,1270.0,34.0,
Court Bouillon ,4.375,33.0,1.0,0.0,624.0,29.0,
Cilantro Dressing ,4.375,147.0,0.0,16.0,3.0,18.0,
Haroseth ,5.0,273.0,4.0,13.0,4.0,74.0,
Watermelon Sorbet with Wine Basil Gelée ,3.125,310.0,3.0,1.0,9.0,33.0,
Chicken and Shiitake Stir-Fry with Peas and Pea Tendrils ,3.75,409.0,37.0,13.0,1281.0,67.0,
Clams Steamed with Ginger and Scallions ,0.0,182.0,22.0,6.0,932.0,86.0,
Mushroom Goat Cheese Pan Sauce ,0.0,90.0,5.0,3.0,74.0,24.0,
Arugula and Peach Salad with Creamy Chive Vinaigrette ,3.75,162.0,1.0,15.0,9.0,87.0,
Grilled Heirloom Tomato and Mozzarella Sandwiches with Green Heirloom Tomato Gazpacho ,5.0,706.0,38.0,40.0,761.0,87.0,
Peach Sundaes with Bourbon-Pecan Sauce ,4.375,541.0,48.0,24.0,863.0,61.0,
Spanish-Style Chicken with Saffron Rice (Arroz con Pollo) ,3.75,1530.0,17.0,110.0,596.0,89.0,
Korean Barbecued Beef ,4.375,60.0,5.0,2.0,137.0,84.0,
Grilled Salmon with Hoisin Glaze and Plum-Ginger Relish ,3.75,635.0,12.0,27.0,117.0,32.0,
Scandinavian Shrimp Salad with Dill and Cornichons ,3.75,224.0,16.0,16.0,952.0,97.0,
Banana Rum Cream Pie ,4.375,376.0,3.0,30.0,179.0,88.0,
Mango-Lime Salad ,0.0,222.0,2.0,1.0,3.0,58.0,
Burnt-Caramel Custards ,3.75,548.0,15.0,36.0,2009.0,23.0,
Lemon Ice Cream and Raspberry Granita Sundaes ,3.75,565.0,43.0,27.0,237.0,62.0,
Curried Sauteed Chicken Chunks with Coconut Milk ,3.125,572.0,7.0,35.0,104.0,75.0,
Chile-Cilantro Butter ,0.0,206.0,0.0,23.0,243.0,67.0,
Steamed Asparagus with Ginger Garlic Sauce ,4.375,132.0,7.0,7.0,737.0,50.0,
Huevos Rancheros With Jalapeños and Garlic ,0.0,373.0,17.0,24.0,170.0,44.0,
Zhoug (Spicy Herb Sauce) ,0.0,430.0,3.0,44.0,421.0,91.0,
Honey Barbequed Salmon with Mâche ,4.375,655.0,13.0,29.0,980.0,80.0,
Roasted Shallot and Tarragon Pesto ,4.375,960.0,11.0,43.0,591.0,13.0,
Chicken Paprikash with Sour Cream ,4.375,827.0,57.0,57.0,870.0,33.0,
Vanilla-Bean Cheesecake with Guava Topping and Mango-Lime Salad ,3.75,804.0,33.0,34.0,1087.0,91.0,
Root Vegetable Gratin with Blue Cheese ,4.375,232.0,5.0,12.0,204.0,65.0,
Apple-Pear Cobbler with Cheddar Crust ,2.5,590.0,11.0,21.0,26.0,67.0,
BLT Chicken with Rosemary-Lemon Mayonnaise ,4.375,799.0,57.0,50.0,1140.0,37.0,
Spring Potato Salad with Tuna ,4.375,287.0,8.0,16.0,66.0,91.0,
Vanilla Ice Cream and Ginger Molasses Cookie Sandwiches ,4.375,728.0,45.0,47.0,1627.0,51.0,
Honey-Roasted Chicken with Lemon and Tarragon ,4.375,1029.0,78.0,57.0,341.0,15.0,
Avocado Quesadillas ,4.375,824.0,14.0,50.0,1629.0,59.0,
Creamy Salsa Verde ,4.375,134.0,3.0,9.0,1157.0,60.0,
Cranberry Relish ,4.375,278.0,1.0,0.0,2.0,57.0,
Sea Bass Fillets in Cilantro Sauce ,3.125,326.0,33.0,20.0,140.0,90.0,
Mashed Potatoes and Butternut Squash ,4.375,283.0,5.0,12.0,106.0,38.0,
Shrimp and Crab Cannelloni ,4.375,679.0,23.0,46.0,443.0,85.0,
Smashed Potatoes and Peas ,2.5,309.0,8.0,14.0,89.0,22.0,
The Elvis ,0.0,168.0,0.0,0.0,2.0,45.0,
Cornmeal Cake with Sweet Rosemary Syrup and Blackberries ,4.375,244.0,4.0,10.0,196.0,21.0,
Feta with Rosemary Pepper Honey ,4.375,215.0,8.0,12.0,521.0,51.0,
Chipotle Aïoli ,5.0,272.0,0.0,30.0,235.0,58.0,
Grilled East Coast Oysters with Corn Jalapeño Salsita ,5.0,500.0,25.0,22.0,240.0,94.0,
Chocolate Walnut Biscotti ,2.5,38.0,1.0,2.0,42.0,32.0,
Apricot and Cherry Country Tart ,4.375,309.0,4.0,16.0,52.0,44.0,
Radicchio Risotto ,4.375,337.0,8.0,12.0,964.0,37.0,
