Title,Rating,Calories,Protein,Fat,Sodium,Price
Red Onion Marmalade with Chestnuts ,0.0,216.0,2.0,10.0,395.0,27.0,
Poblano and Mushroom Tacos ,4.375,153.0,4.0,10.0,56.0,65.0,
Cornmeal Thumbprint Cookies with Summer Strawberry Jam ,2.5,135.0,2.0,6.0,71.0,13.0,
Asian Rice Noodle Salad ,0.0,293.0,7.0,15.0,565.0,32.0,
Tomatoes in Chile-Fennel Oil ,3.75,157.0,2.0,14.0,15.0,65.0,
Panfried Flank Steak with Mushroom Ragoût ,4.375,409.0,40.0,25.0,833.0,81.0,
Veal Stew (Blanquette de Veau) ,3.75,1065.0,12.0,60.0,306.0,75.0,
Mustard-Seed-Crusted Burgers with Horseradish Slaw ,4.375,878.0,75.0,46.0,559.0,47.0,
Green Olive Relish ,3.75,142.0,0.0,16.0,234.0,82.0,
Asparagus Napoleons with Oriental Black Bean Sauce ,4.375,294.0,7.0,18.0,466.0,37.0,
Beet and Endive Salad ,3.125,245.0,5.0,21.0,237.0,14.0,
Chocolate Date-Nut Baklava ,4.375,276.0,4.0,19.0,51.0,82.0,
Crab Salad and Buttermilk Caesar Dressing ,3.75,723.0,12.0,52.0,293.0,76.0,
Southsides Cocktail II ,0.0,356.0,0.0,0.0,36.0,70.0,
Roasted Jalapeño-Tomato Salsa with Fresh Cilantro ,4.375,74.0,1.0,0.0,467.0,30.0,
Antipasto Pasta Salad ,4.375,434.0,19.0,37.0,1232.0,34.0,
Penne with Parmesan Cream and Prosciutto ,4.375,465.0,21.0,22.0,645.0,50.0,
Jewish Onion Bread ,3.75,146.0,4.0,4.0,343.0,83.0,
Apple Walnut Pancakes with Cinnamon Cream and Fudge Sauce '21' Club ,4.375,358.0,3.0,21.0,21.0,80.0,
Apricot-Walnut Crisp ,4.375,612.0,87.0,19.0,1573.0,71.0,
Horseradish Cocktail Sauce ,1.25,397.0,1.0,36.0,957.0,41.0,
Papaya Salsa ,4.375,59.0,1.0,0.0,138.0,78.0,
Ruffled Pasta with Herbed Ricotta and Pine Nut Brown Butter ,4.375,520.0,32.0,38.0,482.0,80.0,
Spice-Rubbed Sustainable Fish Sliders ,4.375,829.0,15.0,45.0,473.0,32.0,
Chicken Cacciatora with Fusilli ,4.375,1478.0,74.0,118.0,1843.0,100.0,
Spicy Curried Mussels ,4.375,627.0,51.0,31.0,852.0,77.0,
Spiced Coffee Mousse ,1.875,441.0,6.0,37.0,37.0,97.0,
Layered Cobb Salad ,4.375,896.0,8.0,42.0,414.0,87.0,
Sea Scallops with Ham-Braised Cabbage and Kale ,5.0,3801.0,626.0,42.0,20492.0,44.0,
Whipped Cream Pastries with Jam and Coffee Glaze ,1.25,426.0,5.0,27.0,160.0,26.0,
Linguine with Shellfish Sauce ,4.375,1197.0,81.0,82.0,728.0,43.0,
Buttermilk Cornmeal Pancakes ,4.375,586.0,32.0,32.0,1585.0,29.0,
Fig and Goat Cheese Crostini ,5.0,57.0,2.0,3.0,88.0,31.0,
Broiled Eggplant with Cilantro Vinaigrette ,4.375,70.0,0.0,8.0,48.0,100.0,
Crostini ,3.75,154.0,4.0,6.0,241.0,94.0,
Roast Lamb with Spiced Red Cabbage ,3.125,2010.0,150.0,149.0,767.0,29.0,
Red-Pepper Mayonnaise ,3.75,273.0,2.0,23.0,757.0,87.0,
Grits with Shrimp and Roasted Red Bell Pepper ,4.375,291.0,14.0,14.0,864.0,78.0,
Fragrant Indian Brittle ,4.375,68.0,1.0,2.0,38.0,55.0,
Simple Leek and Ricotta Tarts ,3.125,1202.0,31.0,87.0,617.0,73.0,
Clam and Oyster Chowder ,3.75,8275.0,608.0,618.0,4011.0,73.0,
Herbed Rib Roast ,4.375,1284.0,91.0,77.0,787.0,12.0,
"New England Blackberry ""Torte"" ",3.75,394.0,5.0,18.0,173.0,14.0,
Mashed Sweet Potatoes with Sage Butter ,3.75,252.0,3.0,9.0,403.0,51.0,
Caramelized Onions with Barbecue Sauce ,4.375,154.0,1.0,7.0,590.0,77.0,
Herb Salad with Pickled Red Onion and Preserved Lemon ,0.0,133.0,2.0,0.0,23.0,51.0,
Tortillas with Grilled Adobo Pork and Pineapple ,3.75,928.0,11.0,15.0,88.0,94.0,
Treacle Scones ,3.75,238.0,4.0,6.0,314.0,11.0,
Caramelized-Onion Pizza with Mushrooms ,4.375,632.0,88.0,18.0,813.0,35.0,
Pasta with Green Vegetables and Herbs ,4.375,813.0,18.0,55.0,232.0,90.0,
Curried Potato and Leek Soup with Spinach ,3.75,200.0,5.0,8.0,63.0,37.0,
Cracked Black Pepper Pull-Apart Biscuits ,5.0,350.0,6.0,19.0,649.0,45.0,
Herb-Roasted Leg of Lamb with Vegetables and Jus ,4.375,1022.0,87.0,60.0,1129.0,39.0,
Okra Beignets with Cilantro Sour Cream Sauce ,3.75,60.0,1.0,5.0,71.0,38.0,
Chicken Picadillo Enchiladas ,3.75,274.0,12.0,16.0,242.0,43.0,
Strawberry Shortcake with Grand Marnier Strawberry Compote and Chantilly Cream ,4.375,570.0,43.0,31.0,522.0,47.0,
Chocolate Curls ,2.5,216.0,3.0,13.0,19.0,56.0,
Moroccan Chicken with Preserved Meyer Lemons and Green Olives ,4.375,406.0,55.0,15.0,321.0,87.0,
Peanut Brittle ,3.125,283.0,6.0,12.0,337.0,15.0,
Pot Stickers ,5.0,371.0,13.0,23.0,1245.0,28.0,
Mule's Hind Leg ,0.0,192.0,0.0,0.0,3.0,36.0,
Cornish Hens with Sweet Vermouth Garlic Glaze ,3.75,740.0,1.0,10.0,16.0,98.0,
Roasted Eggplant and Olive Spread with Pita Bread Chips ,3.75,177.0,5.0,7.0,116.0,45.0,
White Beans with Bacon and Endive ,4.375,224.0,10.0,12.0,557.0,47.0,
Chipotle Beef Stew ,4.375,968.0,55.0,73.0,1945.0,53.0,
Chile-Marinated Pork Sandwiches on Cemita Rolls ,4.375,825.0,30.0,52.0,1212.0,90.0,
Fennel Tsatsiki ,3.75,104.0,5.0,4.0,969.0,36.0,
Cornmeal Biscuits with Cheddar and Chipotle ,4.375,289.0,8.0,17.0,471.0,26.0,
Winter Vegetables with Horseradish Dill Butter ,4.375,332.0,7.0,16.0,123.0,94.0,
Apricot Almond Linzertorte ,4.375,592.0,19.0,42.0,745.0,53.0,
Quaker ,0.0,135.0,0.0,0.0,2.0,35.0,
Chocolate Marquise ,4.375,1553.0,58.0,114.0,488.0,33.0,
Seared Scallops With Pan Sauce ,1.25,230.0,21.0,13.0,1181.0,94.0,
Eggplant and Veal Pastitsio ,3.75,377.0,14.0,18.0,588.0,58.0,
French Vinaigrette with Hard-Boiled Egg ,0.0,538.0,3.0,42.0,25.0,13.0,
Paniolo Rack of Lamb ,3.75,849.0,44.0,48.0,480.0,21.0,
Plum and Almond Cobbler ,3.75,222.0,3.0,6.0,136.0,62.0,
Potatoes and Snap Peas with Egg Mint Mimosa ,3.75,339.0,10.0,17.0,1502.0,80.0,
Orange Whole-Wheat French Toast ,3.75,461.0,18.0,19.0,411.0,16.0,
Seared Scallops with Fresh Fennel Salad and Kumquat-Tarragon Vinaigrette ,4.375,417.0,14.0,34.0,449.0,34.0,
Pork Confit ,4.375,392.0,11.0,38.0,231.0,87.0,
Maple Horseradish Glazed Beets ,4.375,158.0,2.0,12.0,523.0,64.0,
Bacon and Chive Potato Pancakes ,3.125,377.0,7.0,25.0,202.0,93.0,
Red Bell Pepper and Coriander Pancakes with Smoked Salmon ,3.125,26.0,1.0,1.0,27.0,42.0,
Zucchini Ginger Cupcakes ,4.375,381.0,5.0,23.0,399.0,30.0,
Applesauce Cake with Penuche Frosting ,2.5,358.0,3.0,12.0,144.0,39.0,
Turkey Piccata with Tarragon Cream ,4.375,588.0,32.0,36.0,1588.0,80.0,
Red-Cabbage Confit ,3.75,193.0,3.0,5.0,47.0,72.0,
Ginger Spice Cookies ,5.0,110.0,1.0,4.0,144.0,51.0,
Sauteed Red Snapper with Creamed Fennel and Onion ,5.0,844.0,15.0,68.0,385.0,10.0,
Strawberry-Rhubarb Compote with Ginger and Lime ,5.0,279.0,3.0,1.0,18.0,99.0,
Mini Zucchini and Goat Cheese Tarts ,3.75,412.0,7.0,26.0,901.0,68.0,
Grilled Steak Panzanella Salad With Tomato Vinaigrette ,3.75,708.0,41.0,31.0,1004.0,62.0,
3-Ingredient Caramel-Pear Galette ,5.0,234.0,2.0,7.0,213.0,87.0,
Braised Veal Shoulder with Gremolata and Tomato-Olive Salad ,3.75,478.0,57.0,22.0,396.0,76.0,
Tapenade ,0.0,418.0,6.0,42.0,1264.0,63.0,
Tequila and Tonic ,0.0,199.0,0.0,0.0,40.0,89.0,
Spicy Tart Cherry Chutney ,4.375,136.0,2.0,0.0,303.0,56.0,
Feta Puffs ,3.75,148.0,3.0,10.0,105.0,84.0,
Brioche Crusted fish with Jerusalem Artichoke Puree and Jerusalem Artichoke Pickles ,4.375,1275.0,110.0,89.0,1341.0,94.0,
Coconut Bake ,4.375,242.0,4.0,13.0,286.0,20.0,
Boeuf Bourguignon ,4.375,479.0,42.0,24.0,263.0,96.0,
The Easiest Peach-Raspberry Pie with Press-In Crust ,4.375,291.0,3.0,10.0,210.0,40.0,
Chianti-Braised Stuffed Chicken Thighs on Egg Noodles ,3.75,1043.0,84.0,75.0,1041.0,39.0,
Peanut-Crusted Trout with Pineapple Cilantro Relish ,3.75,412.0,30.0,25.0,1037.0,66.0,
Dill Pickles ,0.0,84.0,2.0,1.0,2873.0,64.0,
Chopped Arugula Salad ,4.375,93.0,2.0,7.0,115.0,46.0,
Cream of Potato Soup with Watercress ,4.375,375.0,13.0,18.0,239.0,98.0,
Sour Cherry Chocolate Mousse Cake ,4.375,704.0,10.0,44.0,341.0,87.0,
Raspberry Cheesecake Brownies ,3.75,202.0,3.0,11.0,145.0,66.0,
Spicy Black-Eyed Pea and Rice Frittata ,3.75,170.0,4.0,8.0,603.0,99.0,
Chocolate-Frangelico Cheesecake ,4.375,376.0,6.0,27.0,229.0,61.0,
Ham and Swiss Puff-Pastry Quiche ,4.375,516.0,14.0,38.0,349.0,15.0,
Zucchini and Spinach Frittata ,3.75,183.0,13.0,13.0,180.0,61.0,
Wilted Autumn Greens with Honey Mustard Vinaigrette ,0.0,476.0,10.0,30.0,337.0,41.0,
Thick Apple Pancakes with Raspberry Sauce ,4.375,437.0,11.0,4.0,643.0,96.0,
Crispy Oven-Fried Cod ,0.0,550.0,1.0,12.0,11.0,13.0,
Plum Crisp ,4.375,368.0,4.0,9.0,78.0,28.0,
Green Beans with Roasted Onions ,4.375,420.0,9.0,17.0,42.0,82.0,
Tuscan Porterhouse Steak with Red Wine-Peppercorn Jus ,4.375,1032.0,98.0,56.0,1316.0,14.0,
Roast Leg of Lamb on a Bed of Potatoes and Wilted Greens ,4.375,1285.0,46.0,116.0,1322.0,51.0,
Grilled Brined Chicken with Chimichurri Sauce ,5.0,1508.0,74.0,127.0,837.0,62.0,
Croissant Steak Sandwiches with Caramelized Onions and Horseradish Mayonnaise ,4.375,3146.0,312.0,83.0,1771.0,87.0,
Campari Affogato With Lemon Sorbet ,0.0,178.0,0.0,0.0,6.0,82.0,
Plantain-Stuffed Chipotles Chiles in Escabèche ,2.5,311.0,2.0,14.0,1669.0,100.0,
Wine-Braised Brisket of Beef with Caramelized Pearl Onions and Dried Apricots ,2.5,1087.0,24.0,24.0,1696.0,38.0,
Vanilla Bean-Coconut Cupcakes with Coconut Frosting ,4.375,456.0,4.0,30.0,148.0,14.0,
Passion-Fruit Mimosa ,0.0,118.0,1.0,0.0,20.0,94.0,
Roast Chicken with Maple-Soy Glaze ,4.375,4661.0,62.0,287.0,1082.0,84.0,
Candied Kumquats ,4.375,234.0,1.0,0.0,11.0,11.0,
Duck Confit with Oranges and Watercress ,4.375,5338.0,175.0,245.0,9040.0,18.0,
Grilled Ratatouille Salad with Feta Cheese ,4.375,424.0,12.0,32.0,477.0,54.0,
Polenta Pudding with Blackberry Compote and Mascarpone Cream ,5.0,8624.0,88.0,535.0,5467.0,32.0,
Pork Chops with Wild Mushrooms and Caramelized Onions ,3.75,460.0,19.0,31.0,113.0,18.0,
Creamed Chicken with Corn and Bacon Over Polenta ,4.375,745.0,51.0,40.0,2467.0,21.0,
Creamed Spinach Dip ,3.75,171.0,4.0,16.0,89.0,41.0,
Beef Tenderloin with Smoked Paprika Mayonnaise ,2.5,595.0,8.0,31.0,176.0,94.0,
Celery Root Soup ,2.5,156.0,7.0,5.0,567.0,32.0,
Baked Red Snapper with Fennel-Scented Tomato Sauce ,3.75,528.0,9.0,24.0,560.0,73.0,
Grilled Pork Chops with Chunky Andouille Barbecue Sauce ,4.375,499.0,47.0,28.0,829.0,87.0,
Lamb and Sweet Potato Stew ,5.0,852.0,10.0,65.0,148.0,27.0,
Spiced Sweet Potato Bundt Cake ,3.125,299.0,5.0,9.0,377.0,74.0,
Thanksgiving Stuffed Onions ,3.125,517.0,29.0,16.0,648.0,49.0,
Quick Plum Preserves ,4.375,321.0,2.0,0.0,3.0,93.0,
Artichoke and Feta Cheese Pizza ,4.375,714.0,36.0,47.0,1487.0,94.0,
Cider-Braised Pheasant with Pearl Onions and Apples ,4.375,1295.0,104.0,73.0,444.0,93.0,
Roasted-Garlic and Buttermilk Salad Dressing ,5.0,695.0,59.0,35.0,506.0,21.0,
Asparagus Gratin ,4.375,277.0,10.0,19.0,497.0,19.0,
Sherried Cream of Portobello Mushroom Soup ,3.75,207.0,6.0,17.0,29.0,66.0,
Garlic-Braised Beef Shanks ,3.75,765.0,44.0,27.0,2286.0,85.0,
Spiced Layer Cake with Orange Cream Cheese Frosting ,3.75,616.0,49.0,45.0,828.0,58.0,
Balsamic Berries Over Vanilla Ice Cream ,5.0,170.0,2.0,6.0,4.0,77.0,
Sautéed Greens with Toasted Walnuts ,5.0,112.0,3.0,9.0,808.0,55.0,
Mixed-Berry Crisp ,4.375,628.0,19.0,18.0,1032.0,11.0,
Arugula and Green Bean Salad with Walnut Oil Dressing ,4.375,157.0,5.0,12.0,42.0,42.0,
Everyday Yellow Dal ,5.0,85.0,2.0,7.0,13.0,97.0,
Grilled Hoisin-Soy Steaks with Shiitake and Bok Choy ,5.0,734.0,44.0,52.0,905.0,34.0,
Warm Goat Cheese and Carrot Salad with Marjoram-Honey Vinaigrette ,3.75,391.0,8.0,34.0,270.0,20.0,
Peach and Blackberry Crisp ,4.375,268.0,3.0,13.0,121.0,67.0,
Prunes in Crispy Bacon ,5.0,99.0,2.0,8.0,96.0,79.0,
Maple Apricot Granola ,4.375,343.0,8.0,19.0,102.0,55.0,
Chick-Pea Tomato Stew with Moroccan Flavors ,4.375,402.0,19.0,9.0,330.0,24.0,
Spinach and Cheese Strata ,4.375,509.0,30.0,30.0,1201.0,29.0,
Top Sirloin Steak with Bell Pepper and Onion Sauté ,4.375,1012.0,74.0,77.0,1074.0,39.0,
Spiced Glazed Carrots with Sherry & Citrus ,3.125,81.0,1.0,3.0,199.0,20.0,
Lobster Stock ,5.0,48.0,1.0,1.0,23.0,71.0,
Spicy Baked Shrimp ,4.375,347.0,16.0,28.0,864.0,97.0,
Bolognese Sauce ,4.375,228.0,12.0,17.0,347.0,24.0,
Smoked Paprika and Roasted Red Pepper Butter ,0.0,209.0,0.0,23.0,195.0,94.0,
White Asparagus and Morel Sauté ,4.375,141.0,4.0,12.0,13.0,48.0,
Smokin' Rub ,1.25,48.0,2.0,1.0,99.0,84.0,
Croque Madame With Cranberry-Mustard Relish ,4.375,636.0,11.0,3.0,22.0,75.0,
Caribbean Christmas Pudding with Brandy Butter ,4.375,624.0,8.0,28.0,380.0,33.0,
Cranberry-Apple Cocktail ,0.0,104.0,0.0,0.0,5.0,70.0,
White-Cut Chicken ,4.375,269.0,20.0,19.0,873.0,50.0,
Mesclun Salad with Shallot Vinaigrette ,4.375,94.0,1.0,9.0,37.0,41.0,
Roasted Parsnips and Butternut Squash ,3.75,272.0,3.0,12.0,231.0,21.0,
Fettuccine With Artichokes ,3.75,433.0,12.0,20.0,518.0,73.0,
Pickled Quail Eggs ,4.375,114.0,7.0,5.0,213.0,63.0,
Caramel Sauce ,5.0,407.0,1.0,10.0,34.0,18.0,
Easy Pie Crust ,4.375,192.0,2.0,12.0,153.0,96.0,
Sesame Chicken and Stir-Fried Vegetables ,3.75,310.0,23.0,19.0,371.0,90.0,
Sugar Snap Peas with Tarragon Butter ,4.375,64.0,3.0,3.0,295.0,83.0,
Braised Provencal Chicken with Butternut Squash and White Beans ,4.375,647.0,6.0,37.0,254.0,77.0,
Roasted-Beet and Apple Relish ,2.5,147.0,2.0,0.0,413.0,50.0,
Mushroom Croque-Monsieur ,3.75,771.0,32.0,50.0,1425.0,75.0,
Flourless Chocolate Cake with Toasted Hazelnuts and Brandied Cherries ,4.375,875.0,48.0,47.0,1703.0,88.0,
Quince Compote ,4.375,355.0,1.0,0.0,14.0,82.0,
Raspberry and Fig Gratin ,5.0,235.0,2.0,11.0,33.0,74.0,
Butternut Squash-Parsnip Soup with Thyme ,4.375,262.0,7.0,12.0,80.0,98.0,
Baked Polenta with Fontina Cheese ,4.375,365.0,16.0,17.0,706.0,29.0,
Chicken Tagine with Couscous ,4.375,1180.0,58.0,89.0,886.0,23.0,
Kingston II ,0.0,177.0,0.0,0.0,3.0,18.0,
Cold Curried Pea and Buttermilk Soup ,3.75,205.0,11.0,7.0,512.0,67.0,
Streusel Sour Cream Coffeecakes ,5.0,748.0,51.0,56.0,2171.0,12.0,
Lobster Salad with Spicy Lemon Dressing ,4.375,223.0,9.0,19.0,823.0,38.0,
Sauteed Mushrooms with Melted Stilton ,3.75,551.0,0.0,0.0,30.0,55.0,
Curried Red Snapper ,3.75,305.0,43.0,9.0,152.0,67.0,
Corned Beef and Carrots with Marmalade-Whiskey Glaze ,5.0,636.0,56.0,20.0,1328.0,79.0,
Irene's Beer Stew ,3.75,460.0,40.0,22.0,973.0,50.0,
Almond French Toast ,4.375,705.0,6.0,26.0,17.0,100.0,
Orange Fools ,3.75,501.0,5.0,42.0,61.0,78.0,
BBQ Beef Brisket ,0.0,1078.0,67.0,87.0,379.0,31.0,
Cinnamon-Sugar Plum Cake ,4.375,408.0,6.0,17.0,184.0,92.0,
Breaded Chicken Cutlets (aka Grandma Jody's Chicken) ,3.75,326.0,35.0,16.0,157.0,42.0,
Watercress Sandwiches with Chili-Lime Butter ,3.75,259.0,7.0,13.0,300.0,83.0,
Whipped Crème Fraîche ,4.375,218.0,1.0,18.0,26.0,46.0,
Veal Chops with Saffron Orzo and Tomato Sauce ,4.375,789.0,32.0,42.0,979.0,35.0,
Roast Turkey with Hazelnut Stuffing ,0.0,2351.0,48.0,91.0,1388.0,82.0,
Fennel and Carrot Confit ,4.375,623.0,18.0,33.0,1368.0,52.0,
Angel's Hair Pasta with Lemon and Pine Nuts ,3.75,394.0,9.0,20.0,8.0,56.0,
Apple and Rosemary Tarte ,3.75,442.0,5.0,15.0,15065.0,10.0,
Watermelon and Cantaloupe Wedges with Lime-Mint Syrup ,5.0,162.0,3.0,1.0,35.0,17.0,
Apple-Cranberry Crumb Pie ,4.375,545.0,28.0,20.0,1362.0,13.0,
Red Radishes Stuffed with Blue Cheese ,0.0,29.0,1.0,3.0,34.0,22.0,
Summer Squash Sauté ,3.75,159.0,3.0,12.0,15.0,57.0,
Grilled Salmon with Lime Butter Sauce ,4.375,456.0,35.0,34.0,102.0,36.0,
Cheese Ravioli with Herbs in Meat Broth ,5.0,613.0,16.0,32.0,367.0,57.0,
Tandoori Turkey ,0.0,1715.0,97.0,96.0,3261.0,45.0,
Green Bean and Cherry Tomato Salad with Herb Dressing ,3.75,117.0,2.0,9.0,9.0,74.0,
Pan-Seared Petrale Sole with Local Winter Vegetables ,4.375,866.0,41.0,36.0,1070.0,66.0,
Cranberry Sauce with Roasted Shallots and Port ,4.375,311.0,5.0,2.0,30.0,21.0,
Grilled Yellow Squash with Oregano ,4.375,219.0,1.0,17.0,7.0,21.0,
Fresh Pea Hummus Crostini with Pea Tendril Garnish ,4.375,70.0,3.0,2.0,146.0,63.0,
Pickled Red Onions ,4.375,90.0,2.0,0.0,881.0,16.0,
Kale and White Bean Soup ,3.75,757.0,43.0,61.0,1212.0,57.0,
Pistachio Meringues ,4.375,69.0,2.0,3.0,7.0,70.0,
Roasted Sesame-and Panko-Coated Asparagus with Soy-Ginger Drizzle ,4.375,256.0,6.0,19.0,327.0,81.0,
Grilled Marinated Vegetables with Fresh Mozzarella ,3.75,693.0,33.0,33.0,1763.0,23.0,
Sesame Soy Vinaigrette ,3.125,195.0,0.0,21.0,146.0,21.0,
Vanilla-Buttermilk Wedding Cake With Raspberries and Orange Cream-Cheese Frosting ,5.0,501.0,6.0,33.0,269.0,54.0,
Meatloaf ,3.75,520.0,20.0,39.0,694.0,91.0,
Salmon Platter with Caper Dressing ,4.375,617.0,43.0,42.0,1021.0,96.0,
Potato and Garlic Soup with Herbs ,3.75,304.0,11.0,8.0,87.0,71.0,
Green Beans with Olives ,3.125,98.0,2.0,7.0,48.0,54.0,
Lemon Zabaglione ,5.0,205.0,6.0,7.0,44.0,14.0,
Gravlax with Mustard Sauce ,4.375,293.0,15.0,20.0,508.0,20.0,
Sauteed Baby Artichokes with Oven-Dried Tomatoes and Green-Olive Dressing ,3.75,330.0,10.0,21.0,348.0,69.0,
Raspberry-Peach Compote ,4.375,210.0,3.0,1.0,1.0,72.0,
Spinach and Madeira ,3.125,241.0,8.0,19.0,828.0,45.0,
Black Olive and Goat Cheese Sandwiches ,5.0,357.0,15.0,20.0,803.0,71.0,
Chocolate Plum and Walnut Torte ,4.375,604.0,40.0,44.0,290.0,36.0,
White Bean and Vegetable Soup ,5.0,592.0,33.0,42.0,780.0,70.0,
Yogurt-Braised Chicken with Cashews and Raisins ,4.375,904.0,38.0,70.0,1413.0,13.0,
Lemon-Tarragon Chicken Salad Sandwiches ,4.375,343.0,23.0,24.0,294.0,72.0,
Caramelized-Onion Dip with Cilantro-Garlic Pita Crisps ,3.125,223.0,3.0,16.0,113.0,70.0,
Lamb Chops with Olive Salsa ,3.75,1166.0,82.0,70.0,843.0,40.0,
Dim Sum Dipper ,4.375,67.0,5.0,3.0,3670.0,62.0,
Coriander and Cumin Flatbread ,3.75,121.0,3.0,4.0,288.0,83.0,
Chicken with Chestnuts ,4.375,726.0,45.0,36.0,293.0,50.0,
Spice-Crusted Ham with Maple Mustard Sauce ,4.375,1068.0,50.0,93.0,560.0,54.0,
Watermelon-Lime Sorbet ,3.75,107.0,1.0,0.0,3.0,32.0,
Pico de Gallo with Lemon Zest (Pico de gallo con limón amarillo) ,0.0,35.0,1.0,0.0,1441.0,41.0,
Citrus and Pineapple Compote ,0.0,132.0,1.0,0.0,42.0,28.0,
Indian Lentil and Split Pea Spread ,3.75,262.0,10.0,12.0,34.0,72.0,
Mushroom and Cheddar Cheese Soup ,4.375,364.0,18.0,24.0,801.0,12.0,
Barbecue Chicken Pizza ,5.0,809.0,9.0,80.0,71.0,82.0,
Spicy Broccoli Rabe with Parmesan and Pine Nuts ,5.0,240.0,12.0,19.0,797.0,17.0,
Mulled Wine Melange ,5.0,132.0,1.0,0.0,6.0,24.0,
Hanger Steak with Shallots ,4.375,511.0,42.0,32.0,528.0,49.0,
Quick Paella ,3.75,943.0,41.0,42.0,667.0,69.0,
Baked Alaska Peanut S'mores ,3.75,380.0,6.0,24.0,191.0,55.0,
Ale-Battered Shrimp with Tartar Sauce ,4.375,2923.0,49.0,162.0,2094.0,79.0,
Walnut and Almond Cake with Orange-Pomegranate Compote ,5.0,345.0,8.0,15.0,118.0,23.0,
Winter Fruit Crunch ,4.375,644.0,41.0,40.0,150.0,46.0,
Roast Turkey with Port Gravy ,3.75,2631.0,162.0,182.0,1828.0,56.0,
Cargamanto and Green-Bean Salad with Chimichurri Dressing ,0.0,199.0,2.0,18.0,24.0,52.0,
Spinach and Sorrel Spanakopita ,0.0,228.0,5.0,18.0,474.0,78.0,
"Brioche ""Bread Pudding"" with Caramelized Apples ",5.0,405.0,4.0,21.0,51.0,84.0,
Lamb Moussaka with Currants ,4.375,593.0,8.0,29.0,121.0,99.0,
Iceberg Wedge with Warm Bacon and Blue Cheese Dressing ,3.75,655.0,11.0,61.0,1008.0,98.0,
Zucchini and Saffron Vichyssoise with Scallops ,4.375,217.0,11.0,11.0,656.0,19.0,
Maple Pumpkin Pie ,4.375,208.0,3.0,8.0,186.0,74.0,
Sweet and Chunky Apple Butter ,4.375,326.0,1.0,0.0,4.0,95.0,
Chocolate-Nut Rugelach ,2.5,191.0,3.0,14.0,84.0,38.0,
Spiced Brown Butter Linzer Cookies ,0.0,207.0,2.0,14.0,117.0,87.0,
Cider Spice Cake ,4.375,643.0,22.0,48.0,982.0,23.0,
Parsley Fried Onion Rings ,4.375,828.0,30.0,59.0,1823.0,34.0,
French Apple-Almond Tart ,4.375,482.0,8.0,29.0,142.0,56.0,
Turkey Bone Broth ,0.0,50.0,7.0,2.0,66.0,83.0,
Rhubarb and Raspberry Crostata ,4.375,341.0,5.0,19.0,144.0,48.0,
Veal Scallops with Lemon and Capers ,4.375,319.0,22.0,14.0,1281.0,91.0,
Five-Spice Roast Chicken ,0.0,934.0,14.0,65.0,6369.0,18.0,
Green Posole with Cod and Cilantro ,4.375,322.0,28.0,10.0,821.0,82.0,
A Fruitcake to Love ,4.375,311.0,4.0,15.0,182.0,51.0,
Barbecue Spice-Brined Grilled Turkey ,3.75,751.0,41.0,26.0,1564.0,30.0,
Steak Diane ,2.5,489.0,43.0,23.0,454.0,73.0,
Peaches with Lemon Verbena Cream ,2.5,440.0,3.0,34.0,54.0,78.0,
Radicchio Salad with Pickled Grapes and Goat Cheese ,5.0,250.0,7.0,16.0,1096.0,34.0,
Deep-Fried Turkey with Herbs ,3.75,506.0,38.0,37.0,231.0,72.0,
Warm Arugula Salad with Garlic Croutons ,4.375,460.0,13.0,35.0,268.0,83.0,
Pineapple-Coconut Napoleons with Mascarpone Cream and Pineapple Syrup ,3.125,947.0,61.0,76.0,312.0,47.0,
Garbanzo Bean and Potato Fritters with Red Bell Pepper Harissa ,3.75,324.0,5.0,23.0,513.0,95.0,
Miso Carbonara with Broccoli Rabe and Red-Pepper Flakes ,3.75,871.0,93.0,48.0,248.0,15.0,
Jalapeño Mint Jelly ,3.125,373.0,1.0,0.0,10.0,93.0,
Buckwheat Crêpe Noodles with Chive Butter ,4.375,286.0,9.0,19.0,371.0,14.0,
White Chocolate Mousse ,3.75,231.0,3.0,13.0,43.0,10.0,
Provençal Braised Lamb Chops ,4.375,899.0,78.0,57.0,5684.0,90.0,
White Chocolate Cheesecake with Cinnamon and Lemon ,5.0,838.0,73.0,57.0,1099.0,60.0,
Grilled Peaches with Black Pepper and Basil-Lime Syrup ,5.0,173.0,2.0,4.0,6.0,96.0,
Citrus Arancine with Pecorino Cheese ,4.375,516.0,4.0,48.0,215.0,73.0,
Couscous with Chick-Peas and Tomatoes ,3.75,347.0,12.0,8.0,360.0,31.0,
Cabbage with Shredded Pork-Chinese Style ,3.125,288.0,26.0,16.0,1101.0,29.0,
Malted Walnut Pie ,4.375,621.0,83.0,15.0,554.0,86.0,
Spinach Herb Sauce ,0.0,436.0,3.0,46.0,404.0,59.0,
Tea-Smoked Chicken ,3.75,814.0,8.0,46.0,430.0,55.0,
Roast Pork Loin With Rosemary and Garlic ,3.75,297.0,32.0,15.0,153.0,97.0,
Chilled Corn Soup with Herbed Chicken ,1.875,339.0,34.0,6.0,219.0,79.0,
Mango Frozen Margarita ,5.0,284.0,1.0,0.0,12.0,53.0,
Scallops with Capers and Sun-Dried Tomatoes ,4.375,455.0,19.0,38.0,712.0,56.0,
Blueberry-Raspberry Cake ,4.375,498.0,6.0,20.0,230.0,69.0,
Frozen Milk Chocolate and Amaretto Mousse Pie ,3.75,438.0,4.0,25.0,154.0,79.0,
Spinach-Cheddar Casserole ,3.75,176.0,15.0,10.0,582.0,54.0,
Potato Gratin with Mustard and Cheddar Cheese ,4.375,404.0,17.0,18.0,817.0,91.0,
Kumquat Champagne Cocktail ,4.375,170.0,1.0,1.0,9.0,58.0,
Lemon Tart with Frozen Lime Cream ,4.375,279.0,4.0,16.0,97.0,42.0,
Texas Barbecue Sauce ,5.0,267.0,1.0,4.0,1162.0,43.0,
Sugar Snap Peas with Toasted Sesame Seeds ,4.375,41.0,2.0,1.0,3.0,34.0,
Charred Onion and Fennel Soup ,3.75,292.0,10.0,16.0,1606.0,28.0,
Couscous with Fennel and Pinenuts ,4.375,267.0,10.0,4.0,79.0,69.0,
Creamy Cilantro-Lime Slaw ,4.375,204.0,2.0,19.0,148.0,32.0,
Flaming Brandy Punch ,1.875,232.0,0.0,0.0,8.0,88.0,
Melange ,0.0,96.0,4.0,4.0,69.0,37.0,
Fresh Corn Tortillas ,3.75,23.0,1.0,2.0,61.0,79.0,
Quick Pickled Cucumbers ,4.375,213.0,1.0,0.0,1438.0,16.0,
Chilled Herb Soup ,2.5,188.0,6.0,12.0,204.0,55.0,
Chocolate-Cinnamon Coffee Cake ,4.375,265.0,5.0,11.0,140.0,43.0,
Citrus-Blossom Gin Fizz ,3.125,276.0,2.0,3.0,41.0,36.0,
Pine Nut Dolmades with Yogurt-Feta Dip ,4.375,82.0,3.0,4.0,33.0,51.0,
Cucumbers in Yogurt ,4.375,143.0,8.0,7.0,815.0,76.0,
Oatmeal Coconut Raspberry Bars ,4.375,170.0,2.0,8.0,69.0,58.0,
Tea Bread with Vine Fruit and Pine Nuts ,2.5,331.0,6.0,15.0,298.0,88.0,
Asparagus Tart ,3.75,696.0,18.0,11.0,872.0,64.0,
Grilled Lemon-Herb Poussins ,4.375,936.0,70.0,55.0,2805.0,63.0,
Chicken and Mushroom Marsala ,4.375,1113.0,37.0,97.0,275.0,82.0,
Lamb Chops with Dried Cherries and Port ,5.0,1183.0,14.0,35.0,347.0,88.0,
Chicken with Mustard and Tarragon Cream Sauce ,0.0,1073.0,16.0,74.0,319.0,11.0,
Grilled Lemon-Coriander Chicken ,4.375,963.0,41.0,71.0,1297.0,21.0,
Warm Berry Preserves ,5.0,312.0,2.0,1.0,19.0,26.0,
Crostini with Gorgonzola and Figs ,4.375,94.0,3.0,5.0,144.0,86.0,
Vegetable and Wild Rice Salad ,4.375,435.0,17.0,21.0,1009.0,36.0,
Peppercorn-Crusted Muscovy Duck with Blueberries ,4.375,403.0,42.0,15.0,151.0,81.0,
Cranberry-Ribbon Apple Pie ,5.0,342.0,1.0,3.0,6.0,42.0,
Onion-and Olive-Stuffed Bell Peppers ,3.75,174.0,3.0,10.0,51.0,82.0,
Warm Jasmine Rice Puddings with Passion Fruit ,4.375,365.0,6.0,13.0,196.0,66.0,
Hummus and Vegetable Lahvash Sandwiches ,5.0,781.0,64.0,47.0,1527.0,74.0,
Oyster Stuffing with Shiitake Mushrooms and Leeks ,5.0,231.0,9.0,10.0,252.0,47.0,
Nectarine Lime Curd Tart with a Brown-Sugar Crust ,3.125,576.0,75.0,19.0,2079.0,28.0,
Smoked Chicken Chowder ,4.375,298.0,11.0,22.0,155.0,96.0,
Cranberry and Blood Orange Relish ,4.375,255.0,2.0,0.0,2.0,88.0,
Old-Fashioned Lime Pie ,4.375,3052.0,121.0,250.0,1751.0,67.0,
Turkey Club Salad with Avocado and Mayo ,3.75,696.0,21.0,43.0,66.0,40.0,
Tuna and Vegetable Fettuccine with Lemon Breadcrumbs ,3.75,779.0,43.0,31.0,1505.0,88.0,
Chocolate-Coconut Pound Cake ,4.375,471.0,7.0,24.0,342.0,54.0,
Spiced Pumpkin Layer Cake with Cream Cheese Frosting ,4.375,769.0,69.0,52.0,993.0,53.0,
Roasted Red Pepper with Feta Dip ,4.375,204.0,7.0,17.0,396.0,43.0,
Steamed Clams with Pasta ,3.75,715.0,1.0,73.0,108.0,12.0,
Ricotta Soufflés with Blackberry Compote ,4.375,310.0,8.0,5.0,206.0,48.0,
Apple Ginger Upside-Down Cake ,3.125,244.0,4.0,9.0,159.0,54.0,
Chocolate Tangerine Roulade ,0.0,2800.0,113.0,226.0,937.0,30.0,
Ginger Custard Sauce ,4.375,185.0,3.0,15.0,18.0,31.0,
Penne with Herbed Zucchini and Goat Cheese ,3.75,506.0,20.0,15.0,160.0,24.0,
Molasses Cookie Baskets with Lemon Sorbet and Gingered Fruit ,5.0,518.0,5.0,5.0,10.0,95.0,
Chile-Cumin Lamb Meatballs with Yogurt and Cucumber ,4.375,882.0,6.0,78.0,376.0,39.0,
Grilled Lemongrass Beef and Noodle Salad ,4.375,627.0,24.0,58.0,394.0,96.0,
Beef Spice Rub ,0.0,77.0,3.0,3.0,2885.0,97.0,
Beef Aspic ,0.0,290.0,43.0,8.0,1039.0,26.0,
Avocado and Tomatillo Salsa ,3.75,203.0,3.0,17.0,299.0,10.0,
Red-Braised Pork (Hong Shao Rou) ,3.75,283.0,6.0,26.0,372.0,15.0,
Asian Cole Slaw with Seared Scallops ,4.375,261.0,28.0,6.0,866.0,51.0,
Confetti Vegetable Slaw ,3.125,97.0,1.0,9.0,15.0,54.0,
Lamb Stew with Black Mustard Seeds ,4.375,823.0,24.0,37.0,370.0,43.0,
Prosciutto and Fig Panini ,3.75,523.0,35.0,27.0,2029.0,10.0,
Aromatic Baby Back Ribs ,4.375,1069.0,45.0,94.0,1022.0,70.0,
Grilled Zucchini and Summer Squash Salad with Basil-Parmesan Dressing ,4.375,178.0,5.0,13.0,80.0,68.0,
Fresh Pineapple Sherbet ,4.375,154.0,3.0,3.0,40.0,56.0,
